Date,city,state,country,shape,duration (seconds),duration (hours/min),comments,date posted,latitude,longitude 
8/10/1996 21:00,wharton,oh,us,sphere,900,15 minutes,Strange 75&#39ball of light that move silently at right angleand up and down.,8/20/2001,40.8613889,-83.4616667
8/10/1996 22:00,george (the gorge amphatheatre),wa,us,formation,60,1 minute,Three soft dim lights passing over head at a fast rate of speed in a vee formation.,3/7/1998,47.0791667,-119.8547222
8/10/1996 22:45,seattle,wa,us,triangle,600,10 minutes,Orange triangular object&#44 very distant&#44 very slow&#44 binocular brightness.,12/12/2011,47.6063889,-122.3308333
8/10/1996 23:00,no. hollywood,ca,,sphere,5,5 seconds,Ball of Light Buzzes Burbank Airport,6/18/2004,34.092809,-118.328661
8/10/1996 23:30,kerman,ca,us,light,4,3-4 seconds,I was walking back to my room witch was separete from the house.  I stoped walking to look up at the night sky and saw  star&#44 well what,3/7/1998,36.7236111,-120.0588889
8/11/1996 00:45,owen sound (canada),on,ca,light,120,approx 1/2hr,Objects began moving in a snake like motion (s&#39ing) around the stars.I was out on my balcony enjoying a nice cup of coffee with my,12/2/2000,44.566667,-80.85
8/12/1996 00:30,seattle,wa,us,,30,30 sec.,Young man sees 3x faint yellow light&#44 in triangular formation&#44 pass overhead at very high speed&#44 he thought.  Opaque in middle. Silent.,11/2/1999,47.6063889,-122.3308333
8/12/1996 13:00,cheektowaga,ny,us,disk,900,10-15 minutes,Very large dark grey object  over small community in Western New York frightens non U.F.O believers.,2/14/2008,42.9033333,-78.755
8/12/1996 19:00,bayview jetty,or,,disk,7200,2+ hours,What happen in barview jetty oregon 1996,6/9/2009,26.128688,-97.398314
8/12/1996 22:00,eureka,ca,us,light,600,10 minutes,3 minute picture,1/31/2004,40.8022222,-124.1625
8/13/1996 16:45,texas (in the air over),tx,,sphere,420.0,7 minutes,Unknown Sphere Seen Over Texas,6/18/2003,31.968599,-99.901813
8/14/1996 22:00,cancun (mexico),,,other,300.0,5 minutes,Points of lights in Cancun 96,8/28/2002,21.161908,-86.851528
8/15/1996 01:00,burlington,ct,us,light,600.0,10 min. plus,it was a cool evening when i walked out on to the balcony.  i always loved looking up at the sky at night.  on this particular night i,12/9/2003,41.7691667,-72.965
8/15/1996 01:00,lubbock,tx,us,circle,3600.0,1 hour,Several strange lights in Texas,8/11/2004,33.5777778,-101.8547222
8/15/1996 01:00,new braunfels,tx,us,disk,180.0,3 minutes,Disk-shaped blue&#44 white&#44 red lights,11/9/2004,29.7027778,-98.1241667
8/15/1996 02:30,grand rapids,mi,us,light,1200.0,20 minutes,We saw two red dots of apparent unearthly origin.,3/7/1998,42.9633333,-85.6680556
8/15/1996 02:30,grand rapids,mi,us,light,1800.0,20-30 min,Two small objects that appeared to be non-teresteral,3/7/1998,42.9633333,-85.6680556
8/15/1996 03:00,beeville,tx,us,light,1200.0,two to three hours,I was abducted and I can remember the happenings&#44 I just cant remember what they want.,5/24/2005,28.4005556,-97.7480556
8/15/1996 12:00,gold beach,or,us,other,300.0,2 - 5 min.,Me and my family were on our way to the county fair and we saw the UFO,2/23/2000,42.4075,-124.4205556
8/15/1996 12:30,new zealand,,,circle,2700.0,45 minutes,I will only accept an email reply,6/6/2000,-40.900557,174.885971
8/15/1996 14:00,greenwich,ct,us,rectangle,600.0,10 minutes,A perfect square object&#44 enormous in size&#44 slow in movement with no visible signs of propulsion.,1/31/2011,41.0263889,-73.6288889
8/15/1996 14:30,bethel,ak,us,triangle,120.0,2 mins,I happened to look out my back window and was shocked to see a huge triangular shaped craft at a very high altitude.,2/16/1999,60.7922222,-161.7558333
8/15/1996 17:00,clymer,pa,us,other,20.0,20 seconds,In  August in 1996 I attended a picnic at a friend&#39s farm in Clymer PA and observed a bullet shaped craft.,5/24/2005,40.6680556,-79.0119444
8/15/1996 19:00,richwood,wv,us,formation,2.0,1-2 seconds,Monongahelia National Forest/Marlingto Road UFO Formation sighting.,12/2/2013,38.2247222,-80.5333333
8/15/1996 20:30,beckley,wv,us,other,240.0,3-4 minutes,Silent&#44 low flying helicopter with light scanning below,1/31/2011,37.7780556,-81.1883333
8/15/1996 21:00,kelowna (canada),bc,ca,egg,120.0,2 minutes,Large&#44 bright  two egg-shapped orbs attached together forming oval/circular shape.,7/23/2000,49.9,-119.483333
8/15/1996 21:00,aveiro (portugal),,,light,60.0,1 minute,Star-like Light in the sky made 90 degree turns,2/14/2006,40.640506,-8.653754
8/15/1996 21:30,centerport (long island),ny,us,cross,10.0,10 sec,A light brown transparant disc about the size of the full moon moving across the sky in a NNW direction.,2/16/2000,40.8852778,-73.3766667
8/15/1996 22:00,lexington,va,us,light,5.0,5 seconds,What I saw was a light in the sky that moved silently and very fast down the side of a mountain.,7/16/2003,37.7838889,-79.4430556
8/15/1996 22:00,penrose,co,us,other,900.0,15 min. approx,UFO shot down over military installation,2/14/2006,38.425,-105.0222222
8/15/1996 22:00,wellfleet,ma,us,triangle,1800.0,30 minutes,3 triangular objects with green lights&#44 making no sound&#44 heading east over Welfleet drive-in.,1/17/2004,41.9375,-70.0333333
8/15/1996 23:30,plattsburg,ny,,triangle,1800.0,20-30 minutes,High altitude high speed triangle with red light on each tip performing complex geometric maneuvers.,1/19/2005,44.699487,-73.452912
8/16/1996 14:30,fairfield,oh,us,triangle,60.0,1 minute,Triangle shape observed  on bright sunny day,1/29/2002,39.3458333,-84.5605556
8/16/1996 20:15,santa barbara,ca,us,triangle,3.0,3 seconds,My wife and I were walking towards our car through the back parking lot of Andreas Restaurant after dinner. I was looking towards the d,1/28/1999,34.4208333,-119.6972222
8/16/1996 21:00,aberdeen (uk/scotland),,gb,light,1200.0,20 min,I was out with friends&#44 we saw what we thought were shooting stars&#44 we were wrong.,8/5/2001,57.166667,-2.666667
8/18/1996 03:18,coon rapids,mn,us,other,60.0,1 minute,A V shaped craft with amber colored lights that was a big as a football field heading west towards Anoka&#44 Minnesota on August 18&#44 1996.,12/2/2000,45.12,-93.2875
8/19/1996 05:20,brewster,ma,us,disk,2700.0,45minutes,It was daylight on approxiamately 8/19/96  I just had graduated high school in June and i was living at home with my parents i was not,2/16/2000,41.76,-70.0833333
8/19/1996 22:30,spencer,sd,us,unknown,1320.0,22 minutes,Alien crafts-Eastern South Dakota- late summer early fall 1996,8/16/2002,43.7275,-97.5927778
8/20/1996 02:15,west manchester,oh,us,disk,600.0,5-10 min.,Teen girl  saw circular UFO with orange&#44green&#44reddish-orange .A series of rectangular windows were around the middle body. One window i,3/7/1998,38.6880556,-83.6094444
8/20/1996 17:00,romford (essex) (uk/england),,gb,disk,300.0,5 minutes,Disc shaped green ufo.,4/24/2014,51.583333,0.2
8/20/1996 20:30,phoenix,az,us,light,60.0,1 minute,Star like UFO seen by hospital security flying around Boeing 737 in Phoenix Arizona.,1/10/2014,33.4483333,-112.0733333
8/21/1996 11:30,france,,,other,360.0,5-6mins,Large spiral pattern in sky. wind blew cloud moved pattern didn&#39t 2 armed helicopters completly black arived at area warning of with li,3/7/1998,46.227638,2.213749
8/23/1996 01:00,carlisle (canada),on,,unknown,219300.0,several months,Alien abduction and several visitations,7/26/2002,43.128739,-81.483506
8/24/1996 01:30,osborne,ks,us,,210.0,03:30,They came at night and stabbed my leg and left.,12/23/2002,39.4388889,-98.6944444
8/24/1996 15:00,unknown,fl,,egg,600.0,10 minutes,Egg Shaped UFO seen from air plane over Florida,3/19/2002,27.590521,-80.40655
8/25/1996 04:00,cahas national park (ecuador),,,flash,2.0,seconds,traveling by auto&#4411000ft. in Andes Mts&#44 slowly&#44 large &quot;silver&quot; mass not far above road level flew across in front of us.  We stoped an,1/28/1999,-2.845958,-79.154853
8/28/1996 20:15,bothell,wa,us,triangle,2700.0,45 minutes,Looked out window of my house on a clear night at dusk and saw what looked liked a LARGE Triangular or boomerang type thing appearing l,9/26/1998,47.7625,-122.2041667
8/30/1996 19:00,blacksburg,va,us,sphere,120.0,1 1/2 minutes,Two witnesses&#44 no more than 40 feet from bright white sphere 3 1/2 - 4 feet in diameter blocking our way on rd.,9/24/2012,37.2294444,-80.4141667
9/1/1996 01:00,coral springs,fl,us,light,15.0,15 seconds,bright round light flew over our car two times,2/1/2007,26.2708333,-80.2708333
9/1/1996 17:00,tuscaloosa,al,us,disk,60.0,<1 min.,Saucer skirts clouds&#44 disappears,5/12/2010,33.2097222,-87.5691667
9/1/1996 18:00,ohio-michigan border,oh,,light,60.0,1 minute,A UFO explodes in the sky,11/28/2007,40.417287,-82.907123
9/1/1996 20:00,new holland (rural),il,us,unknown,600.0,10 min,Witnessed an object with 3 lights forming an equilateral triangle on its bottom plane that hovered and made no noise.,2/18/2001,40.1847222,-89.5808333
9/1/1996 21:00,wattsburgh (corry),pa,,other,1800.0,30 mimutes,Spotlights from the sky.,11/11/2003,42.003665,-79.810884
9/1/1996 22:30,wabeno,wi,us,fireball,15.0,15 seconds,orange ball seen following a secret aircrat&#44 at 450 mphin the northwoods of wisconsin.,11/11/2003,45.4386111,-88.6602778
9/1/1996 22:30,wise,va,us,oval,600.0,10 minutes,Mysterious aircraft sighted in the hills of Southwest Virginia,7/1/2002,36.9758333,-82.5758333
9/2/1996 19:50,wanaque,nj,us,formation,90.0,90 seconds,8 vertical strobing white lights above Wanaque reservoir NJ,7/3/2013,41.0380556,-74.2944444
9/4/1996 21:30,belton,mo,us,triangle,1200.0,20 minutes,It was large&#44 fast&#44  transparent&#44 only two hundred yards away&#44 and made absolutley no sound at any time.,6/12/2008,38.8119444,-94.5316667
9/5/1996 01:00,faith,nc,us,triangle,30.0,30 secs,Large black triangle&#44 lights on the corners. Moving 3 or 4 mph right above the treetops. Faint humming noise. 500 Lights On Object0,1/21/2008,35.5869444,-80.4630556
9/5/1996 23:00,snake river (id/or border),id,,sphere,180.0,3 minutes,bright spherical object above Snake River,2/14/2006,46.207215,-119.028724
9/6/1996 20:00,lake shasta,ca,,light,120.0,1-2 min,Object speeds through night sky.,3/7/1998,40.743756,-122.404713
9/6/1996 21:00,englewood cliffs,nj,us,chevron,600.0,10 minutes,On August 6th of 1996&#44 while driving North on Route 9-W from Fort Lee&#44 NJ to Englewood Cliffs NJ&#44 I observed (what appeared to be) a la,12/19/2003,40.8852778,-73.9527778
9/7/1996 03:00,stockton,ca,us,other,240.0,4 minutes,awakening to a being in the doorway of my room,5/24/1999,37.9577778,-121.2897222
9/7/1996 10:50,west manchester,oh,us,triangle,1200.0,20 min.,Triangular object with orange lights circled group of 4 teens &#44hummed and buzzed before exiting town to S. 4 teens joined by 2 adults w,3/7/1998,38.6880556,-83.6094444
9/8/1996 00:00,seattle to tokyo (2 nwa flt 007),,,sphere,10800.0,2-3 hours,Three luminous spheres followed the 747 on the port side as the aircraft headed toward Tokyo. Notified flight attendant. Objects flew c,8/5/2001,47.60621,-122.332071
9/8/1996 02:50,friedberg/hessen (germany),,,oval,70.0,01:10,UFO photographed near Frankfurt/Main,8/7/2007,50.335278,8.755
9/9/1996 05:30,savannah,ga,us,disk,30.0,30 sec.,Unable to sleep&#44 looking out window&#44 became aware of something coming over top of building&#44 lit from beneath&#44 almost luminescent. Slowl,10/2/1999,32.0833333,-81.1
9/9/1996 08:30,san francisco,ca,us,oval,3602.0,seconds/1 hour,I have over three million miles on AA alone and fly everyday.  As we flew from sanfran the normal turn is to the north over the city an,10/27/2004,37.775,-122.4183333
9/10/1996 23:45,siloam springs,ar,us,triangle,300.0,5 minutes,three lights moving in a triangle formation&#44 no sound&#44 all three lights went out at the same moment,7/26/2002,36.1880556,-94.5402778
9/12/1996 11:00,victorville,ca,us,disk,10800.0,3 hours,Saturn/top shaped round disk with black ring circumscribed in bottom and 3-4 companion blobs,9/24/2003,34.5361111,-117.2902778
9/12/1996 15:35,kennewick,wa,us,other,240.0,4 min. approx.,Pulsating white light that disappeared like a vapor.,7/16/2006,46.2113889,-119.1361111
9/12/1996 23:30,rawdon (canada),pq,ca,oval,1500.0,25 min,green light ovale,8/16/2002,46.033333,-73.7
9/13/1996 02:30,york,pa,us,flash,5.0,5 seconds,We both saw something&#44 the same thing&#44 and we both felt really weird about it.,4/25/2002,39.9625,-76.7280556
9/13/1996 20:30,austin,tx,us,triangle,240.0,3-4 minutes,Triangle shaped&#44 low-flying&#44 slow&#44 silent Stealth fighter sized object with a red&#44 revolving light on bottom.,4/27/2004,30.2669444,-97.7427778
9/14/1996 18:00,des moines,ia,us,disk,900.0,15 minutes,my friend and i saw a blurry white shape&#44 &#39bobbing&#39 far off in a blue sky. we got the binoculars and with those saw that it was a class,11/26/2003,41.6005556,-93.6088889
9/14/1996 20:00,battle mountain,nv,us,disk,300.0,5 miutes,Full moon or just after (that time) 8 to 8-30 pm. Two seperate occasions&#44 the first a month earlier. Disc shaped&#44 no lights&#44 featureles,11/1/1998,40.6422222,-116.9333333
9/14/1996 20:30,smithville,nj,us,disk,5.0,5 seconds,Large craft hovers over car. witnessed by 4 individuals in two seperate locations&#33,11/20/2001,39.4938889,-74.4575
9/14/1996 23:30,port adelaide (south australia),sa,au,light,5.0,5 sec,I was driving down the street&#44 a main road&#44 and looked up and saw a green light flash over my head and qwondered what the hell was that,12/16/1999,-34.85,138.466667
9/15/1996 04:00,salem,or,us,teardrop,6.0,6sec,While driving home on State street just East of Lancaster (we were traveling East) a bright lime/jade green &quot;comet&quot; appeared infront of,8/5/2000,44.9430556,-123.0338889
9/15/1996 05:00,la mesa,ca,us,light,30.0,30 seconds,Bright reddish star in La Mesa,8/7/2007,32.7677778,-117.0222222
9/15/1996 10:30,ironton/wayne national forest (northwest of),oh,,sphere,120.0,2 minutes,Spherical orbs that appear to be luminous.,12/2/2000,38.596378,-82.650915
9/15/1996 16:00,vegreville (canada),ab,ca,cylinder,1800.0,approx: 30 minutes,HBCCUFO CANADIAN REPORT:  Golden cylinder was pacing our vehicle.,8/1/2003,53.5,-112.05
9/15/1996 18:00,solomans island,md,,light,600.0,10 minutes,Solid object floating about 20 feet above the tree tops,6/2/1998,38.318458,-76.454119
9/15/1996 21:00,woodville,al,us,triangle,180.0,3 minutes,Object had 4 white lights shining their beams behind it. They swept around to the front and it took off north.,5/28/2005,34.6277778,-86.2744444
9/15/1996 21:00,forks,wa,us,unknown,900.0,15 minutes,In 1996 I was at my daughters in forks washington. about 9 p.m. i steped outside to smoke&#44 i was looking at the stars&#44 it&#39s usualy clou,8/5/2012,47.9505556,-124.3841667
9/15/1996 22:00,madrid,ny,us,other,120.0,2 min,slow moving row of 3 or 4 red window like lights following our road&#44 above the telephone lines after dusk,3/23/2011,44.7502778,-75.1313889
9/15/1996 22:30,trion,ga,us,triangle,30.0,30 seconds,The craft was between earth and a full moon.,8/7/2007,34.5438889,-85.3105556
9/15/1996 23:30,fort nelson (canada),bc,,fireball,900.0,15 min.,It was about 11:30 pm&#44 A friend and I were on our way to attend a collage course in B.C.. We saw what looked like 3 round large balls o,2/24/2001,58.805017,-122.697236
9/15/1996 23:30,fort nelson (canada),bc,,fireball,60.0,1 min.,The round lights looked very hot and  veried in color as they pulsated and hovered over the valley.,10/12/2001,58.805017,-122.697236
9/16/1996 06:15,georgtown/idaho springs (between) (clear creek),co,,disk,60.0,60 sec,obseved a very reflective ufo over a mountian pass it moved across my field of vision was able to record with video camera. good footag,9/26/1998,39.742488,-105.513608
9/16/1996 17:30,manchester (uk/england),,gb,diamond,20.0,20 seconds,Riding Metro-Link Tram from Manchester to Altrincham(UK). Glanced up&#44 don&#39t know why&#44 and glimpsed large Metallic Diamond shape gliding,6/21/2000,53.5,-2.216667
9/16/1996 18:00,concord,ma,us,oval,180.0,3 min?,Large craft seen hovering over trees along Route 2 in Massachusetts.,1/28/1999,42.4602778,-71.3494444
9/17/1996 05:00,lee&#39s summit,mo,,triangle,600.0,10 minutes,triangle with 3 white lights on the bottom and 1 red light on top,1/22/2004,38.910841,-94.382172
9/17/1996 22:00,williamstown,ma,us,formation,300.0,5 minutes,three points of light in the shape of triangle slowly moved across the sky.,5/24/1999,42.7119444,-73.2041667
9/18/1996 00:20,ann arbor,mi,us,fireball,5.0,5 sec.,Falling white light made &quot;u&quot; turn and disappeared.,7/16/2006,42.2708333,-83.7263889
9/19/1996 21:30,avon lake,oh,us,changing,180.0,3 minutes,ufo spotted 9-19-96 on the shores of Lake Erie in Avon Lake&#44 Ohio&#44 United States of America,8/5/2001,41.5052778,-82.0283333
9/19/1996 23:30,paris / arc de triomph (2 furlongs from it (france),,,oval,420.0,7 min,RAINING / AT APPROX 11.30 OR SO MY WIFE AND I SAW A MOVING OVAL OBJECT BEHIND THE CLOUDS&#44 ( VERY CLEARLY )&#44 WHICH WAS GLOWING AND SUDDE,11/23/1999,48.856614,2.352222
9/20/1996 17:00,coweta,ok,us,disk,18000.0,5 hours,I am providing approx. time and dates. I was out our home in the county line road between Coweta and Broken Arrow Oklahoma. I had stepp,10/27/2004,35.9516667,-95.6505556
9/20/1996 23:30,cancun (melia turquesa hotel) (mexico),,,light,5.0,4-5 seconds,3 dull orange lights closely clustered traveling from NNW to SSE. Traveling at high altitude &amp; rate of speed with a abrupt jog to the e,1/11/2002,21.161908,-86.851528
9/21/1996 21:30,maxwell,ca,us,other,600.0,10 minutes,Large&#44 motionless&#44 thimble-shaped object radiating bright light from big windows&#44 1000 ft. over I-5.,2/16/1999,39.2763889,-122.1902778
9/21/1996 23:00,norwich (uk/england),,gb,triangle,10.0,10 seconds,It was very simular to the one on your sight which was seen in Kirkland.  It was a clear night with plenty of stars about&#44 and i wa,7/5/2005,52.633333,1.3
9/22/1996 01:00,denver,co,us,light,180.0,3 minutes,I witnessed 2 unusual and unidentifiable light sources in the sky above Denver. It was an unseasonably warm September evening&#44 no cloud,8/10/1999,39.7391667,-104.9841667
9/22/1996 21:00,pensacola,fl,us,cigar,10.0,10 seconds,silent and fast illuminated craft,11/28/2007,30.4211111,-87.2169444
9/24/1996 17:00,canada,,,disk,1.0,less than 1 sec,Edges of disc are glowing&#44 top and bottom of object have streamlined domes&#44 very aerodynamically shaped&#44 object moving horizontally&#44 le,8/12/2008,56.130366,-106.346771
9/25/1996 22:00,oxford (uk/england),,gb,unknown,600.0,10 minutes,Scanned by something,10/12/2001,51.75,-1.25
9/26/1996 20:00,breckenridge,tx,us,changing,2.0,1-2 seconds,constantly changing nebulous-shaped object flying disturbingly fast at the moment of a full lunar eclipse,9/2/2005,32.7555556,-98.9019444
9/27/1996 04:20,nestleton (canada),on,,cigar,120.0,2 min.,Farmer sees cigar-shaped obj. w/ flashing red light hovering 150 yds away.  Streaks toward him. Wife sees it.  Obj.  streaks off FAST.,12/2/2000,44.152593,-78.798407
9/29/1996 23:00,victoria (canada),bc,ca,light,1200.0,20:00 min.,A very bright light that was hovering and then bolted away.&#9;&#9;,12/2/2000,46.216667,-63.483333
9/30/1996 18:00,central butte (canada),sk,,circle,120.0,2 minutes,Looked like a birthday cake with very bright white flashing lights&#44 stationary in sky above until it quickly moved on.,10/31/2003,50.796543,-106.506844
9/30/1996 22:00,traverse city,mi,us,rectangle,5400.0,22:00to23:30,U.F.O. sighting and lost time.,7/11/2000,44.7630556,-85.6205556
10/1/1996 01:00,lake berryessa,ca,,sphere,15,15 seconds,Deep Blue Sphere seen over Lake Berryessa&#44 California,10/30/2012,38.609741,-122.254045
10/1/1996 01:00,west houston (greenridge @ westiemer rd.; near galleria),tx,us,formation,30,30 seconds,Three bright orange-white lights moving in a V formation from northeast to Southwest The center light would change position front to re,1/28/1999,29.7630556,-95.3630556
10/1/1996 05:30,bainbridge,oh,us,triangle,180,3 minutes,Low-flying triangular object,10/11/2005,39.2275000,-83.2705556
10/1/1996 08:00,new york city (manhattan),ny,us,oval,300,5 mintues,Possible UFO Sighting&#44 Manhattan&#44 New York 1996,2/14/2008,40.7141667,-74.0063889
10/1/1996 17:00,cupertino,ca,us,sphere,600,10 mins,Metalic ball floating motionless in high winds over San Jose&#44 CA.,8/12/2008,37.3230556,-122.0311111
10/1/1996 18:00,safford,az,us,sphere,30,30 sec.,Antigravity flying sphere,10/12/2001,32.8338889,-109.7069444
10/1/1996 22:30,the woodlands,tx,us,fireball,180,2-3 minutes,2 orange fireballs moving across sky ~ crazy acrobatics,12/12/2011,30.1577778,-95.4891667
10/3/1996 20:00,santa fe,nm,us,rectangle,5,:05,Thought it was a plane coming FROM the SE (moving NNW)&#44 it moved at a very regular plane-like speed.  Felt it might have been a militar,5/24/1999,35.6869444,-105.9372222
10/3/1996 20:05,crestone,co,us,light,30,30 seconds,Four balls of light travelling in sky&#44 also see possible related New Mexico report for 10/3/96.,2/14/2006,37.9963889,-105.6991667
10/3/1996 21:00,derby,ct,us,light,2400,30 - 40 minutes,Two large lights were seen high in the sky. The objects swung around&#44 changing position with one another&#44 then the top object vanished.,3/7/1998,41.3205556,-73.0894444
10/6/1996 03:40,kansas city,ks,us,unknown,35,35 seconds,Very Bright blue strobbing/pulsing light in center of some type of craft that flew over house illuminating ground...,1/28/1999,39.1141667,-94.6272222
10/6/1996 13:00,san francisco,ca,us,triangle,1800,30 min,Boomerang Shaped Objects w/ dark &amp; light color scheme,10/30/2006,37.7750000,-122.4183333
10/6/1996 15:00,new york city (manhattan),ny,us,triangle,1200,15-20 minutes,Boomerang-shape&#44 &quot;dividing&quot;? objects.,8/28/2003,40.7141667,-74.0063889
10/6/1996 22:00,fire island (long island),ny,us,other,2700,45 minutes,Fire Island up close encounter with a UFO.,4/27/2004,40.6475000,-73.1463889
10/9/1996 15:30,deming (near),nm,us,other,30,30 seconds,Silent&#44 jet-shaped&#44 beige hovering object viewed. Magnetic interference with watches.,3/19/2002,32.2686111,-107.7580556
10/10/1996 03:20,higginsville,mo,us,triangle,3,3sec,illuminated triangular craft&#44 flying at high speed from South to North,2/16/2000,39.0725000,-93.7169444
10/10/1996 20:00,lake macquarie (nsw&#44 australia),,,light,300,5 min,RED LIGHT WITH OTHER RED FLASHING LIGHT&#44 ONE OBJECT,5/24/1999,-33.093373,151.588982
10/10/1996 22:00,charleston,sc,us,light,300,5 min,Flashing object above Charleston&#44 SC,11/26/2003,32.7763889,-79.9311111
10/10/1996 22:30,monroe county,oh,us,cylinder,60,1 minute,Looked like it went through the hillside,7/8/2004,39.4402778,-84.3622222
10/11/1996 22:00,damascus,va,us,light,60,60 sec.,1996 SIGHTING IN DAMASCUS&#44 VA. WHILE CAMPING IN THE CHEROKEE NATIONAL FOREST.,9/24/2003,36.6336111,-81.7838889
10/13/1996 03:19,reno,nv,us,triangle,2400,40 min.,At 3:19 am&#44 bright light seen outside window and then one small tugboat triangular shaped aircraft seen over the house and then both oc,3/7/1998,39.5297222,-119.8127778
10/13/1996 06:00,gainesville,fl,us,circle,2400,hour,ALIEN CONTACT THROUGH DREAMS,1/28/1999,29.6513889,-82.325
10/13/1996 15:00,astoria (outside of),or,us,circle,30,30 seconds,large metallic object crashed in woods in astoria oregon.,8/16/2002,46.1880556,-123.83
10/13/1996 19:47,odessa,tx,us,diamond,600,10 minutes,We saw a huge diamond shaped object hovering over us.,7/29/2000,31.8455556,-102.3672222
10/13/1996 20:00,encino,ca,us,triangle,3,3 seconds,very large V shaped craft flys from horizon to horizon in 3 seconds&#44 very low and silent (Los Angeles),2/1/2007,34.1591667,-118.5002778
10/14/1996 03:00,gainesville,fl,us,circle,1800,30 min,My sister and I  both had a dream that a ufo was coming to Gainesville. They showed us around the ship&#44and the greys told us that they,8/30/1999,29.6513889,-82.325
10/15/1996 00:45,san mateo,ca,us,light,600,10 minutes,Silent  Close Range White Light seen on Highway 280 south of Highway 92. Witnessed by 3.,12/19/2003,37.5630556,-122.3244444
10/15/1996 03:00,cazadero,ca,us,unknown,120,2 minutes,You won&#39t believe what happened to ME&#33&#33&#33&#33,8/16/2002,38.5333333,-123.0841667
10/15/1996 03:00,austin,tx,us,triangle,300,5 minutes,It was floating right above the tree tops over the houses about 75 feet from the tops os the houses.,4/15/2000,30.2669444,-97.7427778
10/15/1996 18:00,delano,tn,us,other,30,30 seconds,If you don&#39t believe in ufo&#39s you better keep your mind open and be prepared for the unexpected.,12/7/2006,35.2650000,-84.5533333
10/15/1996 23:00,roanoke,va,us,triangle,3600,1 hour,I saw a triangular craft with only red light from front to back on it. Craft stopped over my back yard and shone light down.,2/18/2001,37.2708333,-79.9416667
10/18/1996 23:30,memphis,tn,us,unknown,300,5 minutes,I was spending the night at a friends house when we went outside to check on his dog and my we saw something in the sky.They were a,3/7/1998,35.1494444,-90.0488889
10/20/1996 11:18,tipton,in,us,sphere,900,15 minutes,Sphere shaped  craft hovering above field,6/23/2004,40.2822222,-86.0411111
10/20/1996 18:20,wichita/rose hill,ks,,light,900,15 minutes,While driving observed 3 parallel bright red lights lighting in turn from left to right. These covered sizable area of night sky. Small,1/28/1999,37.709677,-97.308457
10/20/1996 20:20,odessa,tx,us,diamond,300,5 minutes,Driving down busy street at night&#44 quarter of mile or so&#44 thought we saw several helicopters in sky.  Drove right up to it and under it,1/28/1999,31.8455556,-102.3672222
10/24/1996 09:18,springfield,oh,us,triangle,61,1.min 30sec.,It Looked Like A star and then I seen three lights that formed a triangle and i told my brother&#44 and cousion and they seen it to &#44we st,10/2/1999,39.9241667,-83.8088889
