Date,city,state,country,shape,duration (seconds),duration (hours/min),comments,date posted,latitude,longitude 
1/1/1996 01:30,crescent city,ca,us,light,1800,30 minutes,unexplainable white light  above the mountain&#44 flashing it blue&#44 all animals making noises.,12/7/2006,41.7561111,-124.2005556
1/1/1996 03:00,hamilton hill (australia),,,unknown,900,15 mins,it came to me in the form of a dream. i was looking out side my windows of my bedroom and i saw 3 grey beings. they seemed to be about,11/28/2007,-32.075542,115.779634
1/1/1996 03:30,key largo,fl,us,triangle,240,3-4 min,3:30 in the morning observe a black triangular shaped craft fly directly over Key Largo  Fl. aproximately one tholusand ft. up and 2000,6/18/1998,25.0861111,-80.4475
1/1/1996 07:10,phoenix,az,us,,2100,35 min,4 adults see 4 lights move erratically for 35 min.  Then 5 silent boomerang ships w/ glowing silver underbellies fly by in V formation&#33,11/2/1999,33.4483333,-112.0733333
1/1/1996 12:00,san diego,ca,us,sphere,90,30seconds-1minute,A metalic sphere flew across the daytime sky.,12/9/2003,32.7152778,-117.1563889
1/1/1996 21:00,elizabethtown,nc,us,triangle,300,4-5 minutes,TRIANGLE SHAPED SHADOW BLOCKS OUT STARS,8/5/2001,34.6291667,-78.6055556
1/1/1996 23:00,seattle,wa,us,sphere,20,20 seconds,saw circle in lightning,10/31/2003,47.6063889,-122.3308333
1/3/1996 18:15,fort smith,ar,,,60,1 minute,Man taking out trash&#44 sees 3 greenish-yellow balls of light dip down out of clouds&#44 hover&#44 go back up.  Many other obervers&#44 reports.,11/2/1999,35.385924,-94.398547
1/3/1996 23:08,hayward (next to hawyard airport in; i was in airport),ca,us,unknown,6,5-6 seconds,I was with my brother at the airport fuleing up a plane. After that we drove the turkback to the fule center. I was looking toward the,3/7/1998,37.6688889,-122.0797222
1/5/1996 01:30,round lake,il,us,,180,3 min.,Woman sees 2 solid red lights move across sky&#44 maneuvering&#44 &quot;mimicking one another.&quot;  Stop&#44 become green; 1 disappears&#44 then 2nd.,11/2/1999,42.3533333,-88.0933333
1/5/1996 22:00,e. greenville,pa,,,2400,40 min.,Woman&#44 and 2 neighbors&#44 witness a large&#44 white light&#44 which approaches them.  Becomes gold&#44 w/ windows&#44 each a different color.,11/2/1999,40.406488,-75.501848
1/6/1996 04:30,nottingham (uk/england),,gb,diamond,120,2 minutes,bright glowing object left tracer mark as it sped off,2/14/2010,52.966667,-1.166667
1/7/1996 07:00,portland,or,us,,1800,30 min.,Couple witness 2-3 dozen points of light overhead moving SE to NW.  5 min. later&#44 they are seen going SE.  Moved sporadically.,11/2/1999,45.5236111,-122.675
1/7/1996 11:30,st. george,ut,us,,2,2 sec.,,11/3/2005,37.1041667,-113.5833333
1/7/1996 17:00,boise,id,us,triangle,300,4-5 minutes,Huge triangle shaped object seen hovering over Boise Idaho,3/2/2004,43.6136111,-116.2025
1/7/1996 21:00,logan,ut,us,,900,15 min.,Report of green laser beam&#44 probably emanating from the Dept. of Physics at Utah State University.,11/21/2010,41.7355556,-111.8336111
1/8/1996 17:00,langley (canada),bc,ca,disk,21600,approx. 5-6 hours,A disk flew directly over my head. My mom and I continued to watch it for 5-6 hours.,2/5/2003,49.1,-122.65
1/8/1996 21:20,wenatchee,wa,us,,660,11 min.,Radio personality goes out to car&#44 sees 3 &quot;golden globes of light&quot; moving  NNW to SSW.  Each ascends vert.  Other witnesses.,11/2/1999,47.4236111,-120.3091667
1/9/1996 04:45,rockville,md,us,,660,11 min.,Woman  awakened by a bizarre sound&#44 &quot;like a broken lawn mower.&quot;  Sees a bizarre&#44 elongate obj. w/ bright lights on both ends&#44 middle.,11/2/1999,39.0838889,-77.1530556
1/10/1996 18:50,meadville,pa,us,,1800,30 min.,Father and son witness a very peculiar&#44 multi-colored light&#44 as it appeared to rotate.,7/29/2010,41.6413889,-80.1516667
1/11/1996 17:58,woodinville,wa,us,,4,4 sec.,Seattle UFO investigator reports witnessing a brilliantly bright&#44 round&#44 yellow &quot;ball of light&quot; traveling extremely fast to the north.,8/5/2001,47.7544444,-122.1622222
1/13/1996 05:45,lancaster,mo,us,,5,5 sec.,MISSOURI HIGHWAY PATROL Report:  MO Highway Patrol Officer called to relay report from the Iowa Patrol.,8/5/2001,40.5337000,-92.5168
1/13/1996 21:00,selma,or,us,triangle,300,5 minutes,Sighting over Selma Oregon,6/12/2007,42.2791667,-123.6147222
1/14/1996 06:05,charleston,sc,us,,1500,25 min.,Two men witnessed a large&#44 white plume in the morning sky.  (May have been Delta rocket launched from Cape Kennedy at 0600 hrs.),11/2/1999,32.7763889,-79.9311111
1/14/1996 17:00,chesterfield,va,us,,3600,1 hour,,11/3/2005,37.3769444,-77.5061111
1/15/1996 00:00,panama city beach,fl,us,circle,15,15 sec.,Facing the gulf of mexico we noticed a luminescent circular object appear out over the gulf. It was translucent and glowing,11/30/1999,30.1763889,-85.8055556
1/15/1996 02:30,hill city,mn,us,oval,1800,30 mins,Something odd scared the hell out of me and I swear to god it was real,12/23/2002,46.9933333,-93.5983333
1/15/1996 18:00,loredo/eagle pass (between),tx,,formation,90,30 seconds - 1 minute,Liner lights.  4&#44 turn off&#44 3&#44 turn off2&#44 turn off.  High and near the U.S./Mexico Border,3/7/1998,28.709143,-100.499521
1/15/1996 22:00,birmingham (huffman/centerpoint),al,us,teardrop,600,10 minutes,I was working security at a local hospital and was sitting in security truck&#44 which had a monitor for the Birmingham Police Dept instal,6/12/2007,33.5205556,-86.8025
1/16/1996 22:32,monitor,wa,us,,300,5 min.,Chelan Co. Sheriff&#39s Office calls to relay a report of several bright&#44 orange lights moving east above the Wenatchee River.,11/2/1999,47.4869444,-120.4169444
1/16/1996 22:32,monitor,wa,us,,300,5 min.,Husband &amp; wife&#44 other observers&#44 see 3 gold spheres&#44 3&#39 in diam.&#44 fly slowly W to E above Wenatchee R.&#44 then 3 more&#33 Fly over E horiz..,11/2/1999,47.4869444,-120.4169444
1/18/1996 06:30,fayetteville,ar,us,,300,5 min.,Woman &amp; husband witness double&#44 parallel columns of light going straight up into the sky.  The source of light was in rural area.,11/2/1999,36.0625000,-94.1572222
1/20/1996 21:44,stockton,nj,us,light,900,15 mintues,2 men saw craft appear as star and moved at lighting speed and disapear into another star.,12/23/2002,40.4077778,-74.9786111
1/20/1996 22:00,madison,wi,us,,180,3 min.,Anonymous caller reports seeing a cigar-shaped craft&#44 with &quot;8 dim blue and red lights&quot; along its length.  (No other details provided.),11/2/1999,43.0730556,-89.4011111
1/21/1996 22:45,walsall (uk/england),,gb,circle,60,1 minute aprx,small red object with zore degree turning circle,4/25/2002,52.6,-2.0
1/22/1996 11:00,fullerton (xxxx w.commonwealth ave.),ca,us,triangle,360,6 minutes,OBJECT MOVED IN A WAY THAT NOTHING CAN&#33IT APPEARED TO SPIN AND TUMBLE AT THE SAME TIME&#44BUT THE MOTION LOOKED LIKE &quot;STOP ACTION&quot;&#44SO THAT,8/5/2001,33.8702778,-117.9244444
1/23/1996 20:15,minot,nd,us,,900,15 min.,,2/18/2011,48.2325000,-101.2958333
1/25/1996 21:15,redding,ca,us,,720,12 min.,Young boy reports being witness to the strange obj. reported by others over Redding.  Obj. was circular&#44 w/ no lights&#44 not an aircraft.,11/2/1999,40.5866667,-122.3905556
1/25/1996 21:30,phoenix,az,us,,1800,30 min.,Young man and his mother were witness to approximately 4 objects overhead in a formation.,11/2/1999,33.4483333,-112.0733333
1/26/1996 23:59,sedgewick,me,,,120,2 min.,Woman w/ husband witness a white orb&#44 larger than (apparent) size of moon&#44 w/ &quot;orange dots imbedded in it.&quot;  Obj. streaks off.,11/2/1999,44.304065,-68.615518
1/28/1996 21:00,peterborough (uk/england),,gb,cross,300,3-5 minutes,glowing triangles in East Anglia U.K.,10/12/2001,52.583333,-0.25
1/30/1996 23:59,oregon city,or,us,,180,2-3 min.,UFO investigator relays sighting report:  2 women witness 2 very bright lights 25 deg. above horizon&#44 3rd similar obj. approaches both.,8/5/2001,45.3575000,-122.6055556
1/31/1996 02:00,heflin  (talladega national forest at oak level),al,us,light,10800,2-3 hrs,Parked at hunting spot appx 2 a.m. with vehicle facing west. saw bright light  moving north to south at speeds not humanly possible the,4/26/1999,33.6488889,-85.5875
1/31/1996 20:15,buckhead ridge,fl,us,light,330,5 min 30 sec,I observed an object apparently making a controlled reentry or entry into the atmosphere.  It was the size of a medium sized star and ,3/7/1998,27.1300000,-80.8938889
2/1/1996 06:07,woodinville,wa,us,,60,1 minute,Man reports seeing obj. in apparent polar orbit (?)&#44 that appeared to be emitting an erratic strobing effect. (Tumbling satellite??),11/2/1999,47.7544444,-122.1622222
2/1/1996 15:00,doyline,la,us,triangle,180,3 minutes,TRIANGLER CRAFT NEAR BARKSDALE,6/20/2005,32.5355556,-93.4108333
2/1/1996 21:00,big pine,ca,us,,4,4 sec.,Woman sees large triangular obj. w/ white sparks pouring off its nose pass over Hwy 395&#44 disappear to E.  Twice size of moon.,11/2/1999,37.1650000,-118.2886111
2/1/1996 21:05,las vegas,nv,us,,30,30 sec.,UFO investigator and husband witness a very bright light in W sky. Suddenly develops  greenish-blue tail&#44 accelerates up at 45 deg..,11/2/1999,36.1750000,-115.1363889
2/1/1996 22:30,platteville,wi,us,circle,900,15 minutes,circle of lights passed over head,4/27/2007,42.7341667,-90.4783333
2/2/1996 20:00,inverkeithing (uk/scotland),,gb,triangle,7200,2 hours,Saw black triangular&#44 slow moving craft above me then experienced a time lapse unknown to myself.,7/16/2003,56.033333,-3.383333
2/2/1996 20:35,portland,or,us,,5,5 sec.,Man sees wedge-shaped obj. pass overhead at high rate of speed.  Appeared to have 6-8 rectangular&#44 white lights on each &quot;wing.&quot;,11/2/1999,45.5236111,-122.675
2/3/1996 22:44,walla walla airport,wa,,,240,4 min.,Air traffic controller reports a pale yellow light&#44 that looked &quot;square&quot; in his binoculars&#44 pass from SE to directly overhead.,11/2/1999,46.094722,-118.287778
2/4/1996 13:30,marblemount,wa,us,,300,5 min.,Woman &amp; man witness peculiar aircraft &quot;w/ disc above it.&quot;  Suddenly&#44 disc separates from the a/c&#44 flies ahead of it&#33 Very slow flt.(??),11/2/1999,48.5277778,-121.4483333
2/8/1996 00:15,redding,ca,us,,900,15 min.,Man seess obj. shaped like &quot;upside-down ice cream cone&quot; pass slowly overhead.  Yellow&#44 w/ 3 lights on bottom.  Shot flames down.,11/2/1999,40.5866667,-122.3905556
2/8/1996 05:12,recife (brazil),,,oval,2,2 seconds,An oval flying objet crosses the sky in a high speed and in  a straigh line way.,3/2/2004,-8.047546,-34.876962
2/8/1996 07:11,st. joseph,mo,us,sphere,5,5 sec.,Young nurse sees bizarre white&#44 illuminated sphere hovering above treeline to west of hospital.  Obj. suddenly turns green&#44 disappears.,11/2/1999,39.7686111,-94.8463889
2/9/1996 10:00,danville,va,us,disk,180,3 min,Beautiful gold colored disk up close,2/14/2010,36.5858333,-79.3952778
2/9/1996 17:50,langley,wa,us,cylinder,300,5 min.,Five witnesses observe long&#44 slender&#44 tubular obj. w/ pointed nose moving N to S in W sky. Descends&#44 disappears behind Olympic Mtns.,11/2/1999,48.0402778,-122.405
2/9/1996 18:30,redmond,wa,us,,90,90 sec.,Man repts. 4-6 tiny objs. w/ very bright strobing lights fly S to N in W sky.  &quot;Wobbled&#44 weaved vert.&quot; in flt.  4 min. later&#44 N to S&#33,11/2/1999,47.6741667,-122.1202778
2/9/1996 18:45,whidbey island,wa,,,300,5 min.,Five adults witness in W sky an elongate obj. w/ flashing lights moving N to S&#44 like 3 &quot;diamonds in row.&quot; Length 4-7x dia. of moon&#33,11/2/1999,47.998276,-122.439503
2/9/1996 18:45,seattle,wa,us,,300,5 min.,Young man w/ neighbor witness bizarre multiple flashing lights in straight line over E horiz.. Obj. hovered&#44 moved&#44 then streaked off.,11/2/1999,47.6063889,-122.3308333
2/9/1996 19:30,charleston,or,us,,120,2 min.,Man sees bizarre formation of craft fly over Charleston Harbor&#44 all simultaneously turn to SE. 2 types of objects.  Loud noise.,11/2/1999,43.3402778,-124.3288889
2/9/1996 19:45,eureka,ca,us,,240,4 min.,Woman and neighbor witness bizarre formation of up to ten objs. overhead w/ white flashing lights.  Objs. maneuvered; 1/3 of sky.,11/2/1999,40.8022222,-124.1625
2/9/1996 21:40,hollywood,fl,us,,360,6 min.,Man sees a &quot;star&quot; overhead begin to move from W to E&#44 fly w/ oscillating movement&#44 &quot;from side to side&#44&quot; fade from sight. 2nd observer.,11/2/1999,26.0108333,-80.1497222
2/10/1996 11:00,alice springs  (nt&#44 australia),,au,other,5,5 seconds,A humanoid dwarf/troll/grey alien type thing walked up the steps of a pasta restataunt I was in and stared at me.,11/17/1999,-23.697479,133.883621
2/10/1996 17:00,mount shasta,ca,us,fireball,10,10 seconds,Driving on the road which ascends Mt. Shasta&#44 first mile in. Object seen above and to front of car.,11/19/1998,41.3100000,-122.3094444
2/11/1996 14:00,big cypress parks,fl,,circle,30,30 seconds,BIG CYPRESS SWAMP CIRCULAR CRAFT BEING CHASED BY AIR FORCE,3/19/2002,27.664827,-81.515754
2/13/1996 18:30,sweet home,or,us,,2400,40 min.,Caller reported that they had &quot;spotted a UFO&quot; in Sweet Home.  It had red&#44 blue&#44 yellow&#44 and green colors&#44,8/5/2001,44.3977778,-122.735
2/14/1996 18:30,parkers prairie,mn,us,circle,1200,20 minutes,UFO chases car 8 miles. 4 witnesses. Several sightings afterward. 500 Lights On Object0: Yes,2/14/2010,46.1530556,-95.3286111
2/14/1996 20:00,new gretna,nj,us,changing,300,5 minutes,Spherical white lights in a moving semi circular pattern.,1/10/2014,39.5922222,-74.4513889
2/14/1996 21:30,miltona,mn,us,circle,1200,20minutes,Circular object follows car&#44 4 witnesses.,9/21/2000,46.0441667,-95.2911111
2/15/1996 16:00,camden,sc,us,other,300,5 minutes,The  largest fastest moving object that I have ever seen and never heard.,12/16/2005,34.2463889,-80.6072222
2/15/1996 19:30,glasgow (uk/scotland),,gb,circle,600,10minuites,FEB 1996 SHAPE ROUND COLOUR BLACK SIGHTED CALDERBANK SCOTLAND,5/15/2006,55.833333,-4.25
2/15/1996 23:00,st. albert (canada),on,ca,circle,30,30 secs,A bright white object moving slowly across the sky split into 4 other craft 3 of which surrounded the white one in the middle to form a,1/29/2002,53.633333,-113.633333
2/16/1996 04:10,cashmere,wa,us,,5,5 sec.,Woman sees round&#44 orange &quot;globe&quot; of light flying to W.  Wakes husband&#44 who sees obj. briefly.  Obj. flew up valley&#44 disappeared.,11/2/1999,47.5225000,-120.4686111
2/16/1996 21:45,ithaca,ny,us,,180,3 min.,Woman &amp; husband (pilot) see  very large&#44 illuminated obj.&#44 shaped like &quot;upside down cage on a blimp&#44&quot; pass overhead.  Good rept..,11/2/1999,42.4405556,-76.4969444
2/17/1996 19:30,cactus flats,ca,,,300,5 min.,3 men on motorcycles witness 6 large&#44 bright objs. hovering in the sky&#44 1 on the ground.  Objs. illuminate area dramatically&#44 fade out.,11/2/1999,36.215074,-117.929617
2/18/1996 19:45,gainesville,fl,us,diamond,300,5 min.,Man&#44 wife&#44 and 6-yr. old daughter witness &quot;huge&#44 diamond-shaped&quot; obj. SE of city.  Obj. had &quot;massive floodlights&#44&quot; passed overhead.,11/2/1999,29.6513889,-82.325
2/19/1996 20:45,vero beach,fl,us,,2100,35 min.,Young man &amp; woman witness peculiar bright yellow light&#44 w/ &quot;green streaks&#44&quot; in W sky. Moves&#44 turns red.  3rd observer 10 mi. away.,11/2/1999,27.6383333,-80.3975
2/19/1996 22:44,whidbey island,wa,,,10,10 sec.,Three adults see triangular shaped obj.&#44 w/ 4 very bright white lights&#44 streak to the E. Emphasized brightness of light&#44 humming sound.,11/2/1999,47.998276,-122.439503
2/20/1996 01:00,benicia,ca,us,changing,300,5 minutes,it was real close&#44didn&#39t make a sound&#44 didn&#39t stir the air&#44it actually was beautiful&#44a soft red glow all around&#44was changing shape.,11/11/2003,38.0494444,-122.1575
2/21/1996 21:05,north vancouver (canada),bc,ca,sphere,120,2 minutes,softly illuminated sphere about 15 feet in diameter traversed sky overhead at 1&#44800 feet altitude--no detectable sound.,12/2/2000,49.316667,-123.066667
2/23/1996 12:40,poway,ca,us,light,660,11 minutes,Saw 2 points of light moving slowly across sky then after 11 minutes&#44 1 of them streaked off towards the east and was gone in 10-12 sec,4/2/1999,32.9627778,-117.035
2/23/1996 20:15,los angeles,ca,us,triangle,120,1-2 minutes,At 20:15 Pacific time on 2/23/96&#44 while out on balconywith telescope&#44 looked west&#44 south west&#44and saw 3 triangularshaped objects with a,3/7/1998,34.0522222,-118.2427778
2/23/1996 21:29,madison,tn,us,,60,1 min.,Several children witness a &quot;small silver disc w/ a white light on top.&quot; Streaks off.   Mother separates them &amp; they draw same obj..,11/2/1999,36.2561111,-86.7138889
2/23/1996 22:30,prineville,or,us,,120,2 min.,Man&#44 2 other adults&#44 witness large&#44 rectangular obj. w/ &quot;curious&quot; red&#44 blue&#44 green &quot;blended colors&quot; on bottom pass overhead.,11/2/1999,44.3000000,-120.8333333
2/24/1996 03:15,edwards afb,ca,,,120,2 min.,Controller at Edwards AFB reports receiving two calls from local law enforcement re orange fireball. Radar neg.  (Missle launch??),11/2/1999,34.924031,-117.891208
2/24/1996 03:20,tehachapi mtns.,ca,,light,180,3 min.,Couple see very bright&#44 orange/red obj. approach from W&#44 turn 90 deg.&#44 go S.  Large&#44 comet-like tail. (Missle from Vandenberg AFB).,11/2/1999,35.027425,-118.825442
2/24/1996 03:27,glendora,ca,us,,120,2 min.,Several police officers observe large red ball of light move S&#44 then E&#44 then S&#44 disappear from sight. (Missle launch from Vandenberg.),11/2/1999,34.1361111,-117.8644444
2/25/1996 02:30,doylestown,pa,us,,180,3 min.,Driving on Rte. 313&#44 man sees 3 bright &quot;meteorites.&quot;  Eng. &amp; lights fail&#44 van stops abruptly.  Paralyzed&#44 feels something &quot;scan&quot; mind.,11/2/1999,40.3100000,-75.1302778
2/26/1996 22:00,ft. mcpherson (canada),nt,,light,900,15 minutes,unknown moving light.,3/11/2006,67.436445,-134.880755
2/27/1996 21:30,detroit,mi,us,light,1200,20 min,I was a commuter airline pilot at the time (co-pilot).  We were flying from Pittsburg&#44 PA to Saginaw&#44 michigan at an altitude of 16&#44000,9/28/2002,42.3313889,-83.0458333
2/27/1996 22:00,cleveland artcc,oh,,,600,10 min.,FAA controller calls to recount event of commuter airliner near Saginaw&#44 MI.  Says pilot reported pulsing ball of light ahead of a/c.,11/2/1999,40.417287,-82.907123
2/27/1996 22:01,saginaw,mi,us,light,480,8 min.,Commuter airliner w/ passengers turns&#44 descends 12&#44500&#39 to avoid a bizarre&#44 extremely bright obj. directly ahead.  Obj. could &quot;jump.&quot;,11/2/1999,43.4194444,-83.9508333
2/27/1996 22:01,saginaw,mi,us,,1440,24 min.,,3/2/2004,43.4194444,-83.9508333
2/28/1996 07:10,newcastle,wa,us,,120,2 min.,Man &amp; wife witness four small&#44 metallic-looking objs.&#44 reflecting bright sunlight&#44 go streaking N to S.  First 2x&#44 then a 3rd&#44 &amp; 4th.,11/2/1999,47.5391667,-122.1544444
2/28/1996 19:45,tri-cities,wa,,,30,30 sec.,Businessman driving to W sees pulsating bluish-white light ahead of his car moving from N to S.  Very bright&#44 strobing light.,11/2/1999,46.235,-119.223301
2/28/1996 19:48,bothell,wa,us,,2,2 sec.,Man repts. seeing a large&#44 extremely bright &quot;red&#44 blue&#44 and whitish&quot; obj. streaking from S to NW.  Former pilot&#44 estimates Mach 3+.,11/2/1999,47.7625000,-122.2041667
2/28/1996 19:50,lynnwood,wa,us,,3,3 sec.,Man driving to west witnesses a very bright&#44 white ball of light streak from S to N directly ahead of him 20 deg. above horizon.,11/2/1999,47.8211111,-122.3138889
2/28/1996 19:50,redmond,wa,us,,4,4 sec.,2 adults see an extremely bright&#44 round&#44 &quot;neon green/white&quot; ball of light streak from S to NE in horiz. flt.  Extremely bright &amp; fast.,11/2/1999,47.6741667,-122.1202778
2/28/1996 21:00,la crosse,wi,us,light,120,2 minutes,I was in a building downtown on the third floor&#44 I looked out the back door towards my home (about 7 blocks away) to the east and I saw,2/16/2000,43.8013889,-91.2394444
2/29/1996 01:15,cedar springs,mi,us,,900,15 min.,Couple experience 2nd sighting of three lights over their rural home.  Objects flashed red&#44 green&#44 white; distinct movement.,11/2/1999,43.2233333,-85.5513889
2/29/1996 19:45,redmond,wa,us,,35,35 sec.,Mother&#44 2 young women witness an intensely bright&#44 bluish-white&#44 flashing light to the E.  Obj. moved&#44 became orange&#44 pink.,11/2/1999,47.6741667,-122.1202778
3/1/1996 08:00,norman,ok,us,light,1800,20-30min.,it was a very bright light. the 1st big light stayed in one spot for about 20 min. the other light would come out of the big light. the,10/30/2006,35.2225000,-97.4391667
3/1/1996 19:00,byron,ny,us,formation,10800,3 hours,I had a 3 hour lost time experience&#44 on my front porch one night.,1/29/2002,43.0797222,-78.0641667
3/1/1996 19:08,issaquah,wa,us,,120,2 min.,Couple witness bizarre object circle overhead&#44 fly to the W at slow speed.  Red light in center&#44 white flashing on nose&#44 blue behind.,11/2/1999,47.5302778,-122.0313889
3/1/1996 19:30,seattle,wa,us,,10,10 sec.,Woman walking dog&#44 witnesses a large&#44 oblong obj.&#44 very bright yellow-orange&#44 streak overhead at &quot;incredible speed.&quot;,11/2/1999,47.6063889,-122.3308333
3/1/1996 19:55,redmond,wa,us,,60,1 minute,Four young people see bright orange &quot;fire in the sky&quot; pass slowly overhead&#44 fly W.  Possibly 4 tiny lights on each corner. Bizarre&#33,11/2/1999,47.6741667,-122.1202778
3/1/1996 19:58,bothell,wa,us,,600,10 min.,Experienced UFO investigators witness elliptical obj. w/ red light in middle&#44 white &amp; blue lights on ends.  Chase in car for 10 min..,11/2/1999,47.7625000,-122.2041667
3/1/1996 21:30,seatac,wa,us,,900,15 min.,Man reports seeing bright light 20 deg. above W horizon.  Red&#44 white&#44 green&#44 blue.  (Probably Venus.),11/2/1999,47.4538889,-122.3205556
3/1/1996 22:15,bath,il,us,,60,1 minute,Woman&#44 children&#44 neighbors witness &quot;big orange ball of light.&quot;  Obj. dims&#44 then reappears w/ red blinking light.  Moves off fast.,11/2/1999,40.1933333,-90.1408333
3/2/1996 00:30,mountain village,ak,us,,3600,60 min.,Woman repts. stationary light &quot;w/ search light going around in circles.&quot;  Red&#44 blue&#44 white in middle.  (Possible twinkling star?),11/2/1999,62.0855556,-163.7294444
3/5/1996 19:45,whidbey island,wa,,light,120,2 min.,Two women witness 3 &quot;huge&#44 bright golden lights&quot; hovering above water to NW of home. Objs. dimmed in sequence&#44 disappeared.,11/2/1999,47.998276,-122.439503
3/6/1996 18:05,lakeside,ca,us,light,1200,20 min.,I CALL THIS &quot;BIG RED&#39   APROX 100 ft .accross---NO sound--HOVERED barely above tree tops.,3/19/2002,32.8572222,-116.9213889
3/6/1996 19:00,frankfort,il,,other,600,10 min.,Object was 50 ft. across the bottom&#44 dome on the top&#44red&#44green&#44 and blue lights on the sides around&#44150 approx. off the ground.,1/28/1999,41.495867,-87.848661
3/7/1996 00:25,coral gables,fl,us,,2700,45 min.,Young man and woman report witnessing an obj. in the W sky&#44 that was moving &amp; flashing red&#44 blue&#44 and white.  Moved suddenly.,11/2/1999,25.7211111,-80.2686111
3/7/1996 20:55,henderson,nv,us,,120,2 min.,Man &amp; wife witness odd obj. w/ red and orange flashing lights fly very low over their house from the SE. Reversed direction&#44 flew off.,11/2/1999,36.0397222,-114.9811111
3/8/1996 01:00,llano,ca,us,oval,300,5 min,This huge craft made no sound at all as it moved.,8/5/2001,38.4119444,-122.7933333
3/9/1996 01:15,boise,id,us,,90,90 sec.,Two young men in public park witness &quot;meteor&#44&quot; then realize there are multiple tiny V-shaped objs. overhead. Objs. form wedges.,11/2/1999,43.6136111,-116.2025
3/9/1996 21:05,morristown,nj,us,other,2,seconds,Orange Glowing Dot Between Orion and Canis Major Constellations.,1/30/2014,40.7966667,-74.4819444
3/11/1996 15:33,salisbury&#44 wilts. (uk/england),,,disk,180,3 mins,UFO was sighted to side of lane . I stopped car and got out to communicate with craft - which flew off at very high speed .,4/1/2000,51.068785,-1.794472
3/12/1996 17:30,clacton-on-sea (uk/england),,gb,triangle,60,1min,Black triangle 1996 Essex England,10/12/2001,51.783333,1.166667
3/13/1996 23:05,pink hill,nc,us,,240,4 min.,Man walks onto porch&#44 notes very bright light in sky with&quot;4 small lights on one end&#44 giving off sparks on other.&quot;  Suddenly moves off.,11/2/1999,35.0550000,-77.7466667
3/14/1996 10:00,shafter,ca,us,unknown,600,10 minutes,Object goes through shinihg hole&#33  ((NUFORC Note:  Possible hoax??  PD)),11/8/2005,35.5005556,-119.2708333
3/15/1996 01:00,spokane,wa,us,flash,120,2 minutes,Falling star turns into flash&#44 then flash goes away&#44 then in a total different direction what looked like a satellite goes out of site&#44,7/3/2013,47.6588889,-117.425
3/15/1996 01:30,cotati,ca,us,sphere,120,approx. 2 minutes,Small&#44 clear orb that floated up the hood of our car and up the window without changing shape or being affected by engine heat.,1/31/2011,38.3269444,-122.7061111
3/15/1996 03:00,san felipe (driving south to) (mexico),,,diamond,900,15 min.,While traveling to San Felipe for a fishing trip Three Immigration Inspectors and myself a Customs Inspector spotted a &quot;diamond&quot; to the,11/20/2002,10.340556,-68.736944
3/15/1996 13:00,wethersfield,ct,us,disk,50,50 seconds,Two F-15&#39s or F-16&#39s&#44 couldn&#39t tell the engine set-up&#44 followed a silver object over Wethersfield from South to North (toward Hartford),8/30/1999,41.7141667,-72.6530556
3/15/1996 18:00,houston,tx,us,changing,900,15 min,I WAS WALKING OUT MY BACK DOOR AND LOOKED UP AND SAW A SHAPE MOVING FROM SOUTH TO NORTH ABOUT AS FAST AS A SMALL PLANE&#44 IT WAS CHANGING,1/3/2001,29.7630556,-95.3630556
