Date,city,state,country,shape,duration (seconds),duration (hours/min),comments,date posted,latitude,longitude 
11/14/1983 18:30,buckhorn lake (canada),on,,disk,600,5-10 min,Close encounter five adult witness,9/29/2004,44.496402,-78.389118
11/15/1983 17:00,virginia beach,va,us,light,900,15 minutes,Cloaked lights in the trees,6/12/2008,36.8527778,-75.9783333
11/15/1983 23:30,sutherland,ne,us,other,900,15 minutes,Strange Craft sited&#44 just hung in the air&#44 gray black in color. emitted a winning sound.,11/26/2003,41.1569444,-101.1258333
11/28/1983 23:00,lake okeechoobee,fl,,oval,600,10 minutes,Pulsating white lighted craft hoverd over us while hunting.,12/2/2013,26.923519,-80.854385
12/1/1983 02:00,madison,wi,us,unknown,150,2.5 minutes,Object moving slowly down a row of homes. Crossed boulevard and disappeared over warehouse. drove under it thinking it a police helicop,1/28/1999,43.0730556,-89.4011111
12/5/1983 05:00,kent,wa,us,unknown,1,1 second,An object shot across the sky&#44 came to a stop&#44 continued on and burned out.  Looked just like a shooting start except that it stopped.,8/30/1999,47.3811111,-122.2336111
12/15/1983 01:15,garner,nc,us,triangle,900,15 minutes,An in trouble triangle UFO seen hovering above tree top level in a residential neighborhood.,4/28/2001,35.7111111,-78.6144444
12/31/1983 20:00,charlottesville,va,us,disk,60,1 minute,I now write about the saucer I saw in the 80&#39s near Charlottesville&#44 Va.,5/2/2011,38.0291667,-78.4769444
