Date,city,state,country,shape,duration (seconds),duration (hours/min),comments,date posted,latitude,longitude 
11/9/1975 21:15,beloit,wi,us,disk,30,30 seconds,a friend and i were walking north thru a field between afton road and and the kruger golf course to meet a third friend. the sky was cl,8/5/2001,42.5083333,-89.0316667
11/13/1975 21:00,falls church,va,us,circle,300,5 min,circular&#44bright multicolored lights rotating around middle of object,9/2/2005,38.8822222,-77.1713889
11/13/1975 21:15,woodbridge,va,us,circle,600,10 min,BRIGHT OBJECTS  CHASED INTO BELMONT BAY,5/11/2005,38.6580556,-77.25
11/15/1975 20:00,albany,ny,us,circle,30,30 seconds,UFO Sighting Occurred: 11/?/1975 approx 8:00pm EST Location: Albany&#44 NY Shape: Bright&#44 White light Duration: approx 30 seconds  I just,2/14/2008,42.6525000,-73.7566667
11/15/1975 20:00,catskill,ny,us,formation,20,20 seconds,On my way across the rip van winkle bridge with my mother as a passenger we stopped my truck when we saw multiple dark gray football sh,12/12/2011,42.2172222,-73.865
11/15/1975 21:00,anderson,in,us,disk,300,5 minutes,Large craft with lights and whirring sound. Object stopped mid air. Lights sequenced. Object darted and stopped twice.,3/21/2003,40.1052778,-85.6802778
11/15/1975 21:30,girard,oh,us,oval,45,45seconds?,low flying oval light with zig zag bands on it .,6/20/2005,41.1538889,-80.7016667
11/15/1975 23:00,townsend,ma,us,circle,1200,20 minutes,Bright object resembling a full moon with strobe like chaser lights going around the bottom. Used a spot light then left.,10/30/2006,42.6666667,-71.7055556
11/15/1975 23:00,miami,fl,us,disk,240,3 to 4 min,The object ws sighted from the cockpit of a Choey Lee sloop&#44 docked by a condo on a causwat between Miami &amp; Miami Beach. It first appea,12/14/2004,25.7738889,-80.1938889
11/16/1975 03:00,miami,fl,us,teardrop,3600,1 hour,UFO lights in night sky&#44 one came down and was wittnessed by young girl.,11/19/2012,25.7738889,-80.1938889
11/20/1975 01:00,miami,fl,us,oval,10800,3 hours,At 01:00 hrs looking out my room window I saw about 14 lights moving in the sky&#44 they  began to pair off and move in diffrent direction,7/5/1999,25.7738889,-80.1938889
11/20/1975 17:00,hudson,ny,us,unknown,30,30 sec?,I was alone&#44 travelling north east on a local side road (Harry Howard Ave.) coming out of Hudson and on my way home from one of our bus,9/15/2005,42.2527778,-73.7913889
11/20/1975 20:00,yonkers,ny,us,light,900,15 minutes,A fast object in the night sky,4/9/2004,40.9311111,-73.8991667
11/25/1975 23:00,unspecified location in wv,wv,,triangle,600,10 min,Mercedes shaped red UFO,11/21/2010,38.597626,-80.454903
11/27/1975 16:30,reno/stead,nv,,disk,300,5 min,Disk shaped craft hovering above house in Stead&#44 Nevada,12/19/2003,39.660829,-119.874134
12/1/1975 02:00,edgewater,fl,us,fireball,3600,1 hour,lg glowimg ball Florida 1975  S. of Edgewater  after midnight maybe around 2:00 for an hr. jit looked floating ground level,1/17/2004,28.9886111,-80.9025
12/1/1975 04:00,hollywood,ca,us,disk,60,1 minute?,Classic Saucer over Hollywood at Christmas Season 1975,4/15/2000,34.0983333,-118.3258333
12/1/1975 22:30,louisville,ky,us,fireball,240,4mins,bright orange &#44very high in space&#44going from south to the north--going a a fast speed&#33,11/21/2010,38.2541667,-85.7594444
12/7/1975 11:45,jacksonville,fl,us,triangle,300,3-5 minutes,WHILE WALKING ON ATLANTIC BOULEVARD IN JACKSONVILLE I WITNESSED A BOOMERANG SHAPED OBJECT ALMOST COLLIDE WITH A COMMERCIAL AIRLINER,1/28/1999,30.3319444,-81.6558333
12/16/1975 21:00,cranberry ortage (canada),mb,,disk,3600,1 hour,Me and two of my friends were snowmobiling on lake atapapuskow and then we stop for a cigarette when we saw a light coming toward us we,8/24/2004,54.586111,-101.377222
12/18/1975 00:30,clermont,in,us,disk,600,10 minutes,Disk-shaped saucer over house w/ a lazer light focused on home,6/9/2009,39.8097222,-86.3225
12/20/1975 21:00,sunnyvale,ca,us,light,900,<15 minutes,large blue light with no sound; was unable to move,5/14/2002,37.3688889,-122.0352778
12/21/1975 19:00,north attleboro,ma,us,sphere,900,15 minutes,Outline of the craft clearly seen&#44 rotating lights&#44 no noise&#44 slowly moving south,12/20/2000,41.9833333,-71.3333333
12/23/1975 02:00,bowie,az,us,oval,600,10 minutes,This goes back a long way to December 1975. For obvious reasons I never reported it. Traveling cross country from Houston TX&#44 to San Di,2/24/2007,32.3263889,-109.4863889
12/24/1975 21:00,winters freeway,ca,,rectangle,10800,2to 3 hours,i lost about 2 to 3 hours  when i drove off i felt sad almost in tears like i lost a dear friend&#44&#44&#44,12/12/2009,36.778261,-119.417932
12/25/1975 23:00,tampa,fl,us,triangle,300,5 minutes,Zig Zagging Star Over Tampa Florida,6/2/2013,27.9472222,-82.4586111
12/26/1975 20:00,new britghton,mn,,sphere,480,8 minutes,bright light then red blue green lights came on then took off dim lights so fast in south east of state,2/7/2014,45.065521,-93.201891
12/31/1975 19:30,webb,ms,us,disk,300,approx 5 mins,My wife and myself were traveling to a friends house for a new years party. We started from Coffeville Missisippi on State Road 32 via,6/18/2004,33.9472222,-90.3441667
12/31/1975 22:30,lisle,il,us,light,120,2 minutes,December 31st&#44 1975. It was maybe around 10:30 pm. My husband (noW ex-husband) and I had been working in Westmont. We were headed to hi,6/3/2010,41.8011111,-88.0747222
