Date,city,state,country,shape,duration (seconds),duration (hours/min),comments,date posted,latitude,longitude 
9/16/1997 19:00,minneapolis,mn,us,other,120.0,1/2 minutes,Morphing Triangle,6/20/2005,44.98,-93.2636111
9/17/1997 18:00,delilah lookout (sequoia n f),ca,,disk,1200.0,20 minutes,Right around dusk&#44 my girlfriend and I had just finished dinner in the fire lookout tower. She spotted something to the north&#44 over a m,11/17/1999,36.804233,-119.117473
9/18/1997 04:15,west manchester,oh,us,changing,6300.0,1hr. 45min.,My husband and I saw an object hovering in the sky north of our home at 4:15 a.m. E.S.T. September 18&#441997&#44 Thursday. It looked like a,10/2/1999,38.6880556,-83.6094444
9/18/1997 20:15,panama city,fl,us,unknown,30.0,30 sec.,Looked like stars in the sky so far up/moveing fast,3/13/2012,30.1586111,-85.6602778
9/18/1997 22:15,doha (qatar),,,circle,15.0,10-15 sec,UFO sighting In a Gulf Desert,8/5/2001,25.286667,51.533333
9/19/1997 05:40,orland park,il,us,rectangle,240.0,3-4 minutes,When pulling out of my driveway headed north I noticed a stationary bright white light above the west horizon which suddenly sped off t,6/2/1998,41.6302778,-87.8538889
9/19/1997 21:00,seattle,wa,us,other,120.0,1-2 min,On the night described above&#44 We were getting ready to leave a freind&#39s house in West Seattle. I was the first one out the door. While,1/28/1999,47.6063889,-122.3308333
9/20/1997 22:15,poway,ca,us,triangle,1320.0,22 min,lights in the shape of a &quot;V&quot; were observed by approx 12 people&#44 nobody had an explanation of what they saw&#44 and nobody had ever seen su,2/16/1999,32.9627778,-117.035
9/21/1997 14:00,manoa valley (honolulu),hi,,disk,20.0,20 seconds,Hovering Craft over Manoa Valley&#44 Honolulu Hawaii. Greyish Color Shot directly upwards with no sound.,1/28/1999,21.298056,-157.824444
9/22/1997 03:00,st. louis,mo,us,other,3600.0,approx 1 hr,We had just moved into our new home and could not sleep.  At approx. 3:00 a.m. I noticed a glowing object in the eastern sky at about h,1/28/1999,38.6272222,-90.1977778
9/22/1997 14:00,palo,mi,us,cigar,360.0,6 minutes,I was sitting outside on the Phone with a friend when I looked up and saw a silent&#44 cigar shaped craft flying west to east due north of,1/28/1999,43.1125,-84.9855556
9/22/1997 20:00,solomons island,md,,disk,600.0,10 minutes,Close up at twilight&#44  Stationary UFO.,8/5/2009,38.318458,-76.454119
9/23/1997 19:00,denison,ia,us,disk,300.0,5 minutes,After seeing the SR71 Blackbird I saw a saucer shaped craft hoovering silently.,2/18/2001,42.0177778,-95.355
9/23/1997 20:00,hyde park,vt,us,fireball,15.0,15 seconds,Glowing green ball skirting along grounds of house,6/6/2000,44.5938889,-72.6169444
9/23/1997 20:00,rhinebeck (south of),ny,us,triangle,30.0,30 seconds,2 sightings of apparently the same triangular object&#44 moving above tree level at a very slow rate of speed with only a dull hum,5/24/1999,41.9266667,-73.9130556
9/23/1997 22:30,brewster,ny,us,triangle,30.0,30sec,Triangle Shaped-Matte finished flying object &quot;floating&quot; across the sky&#9;,8/30/1999,41.3972222,-73.6175
9/24/1997 14:30,muskegon,mi,us,disk,2.0,several seconds,Saw from a car. Metallic saucer about 1 mile away.,4/15/2000,43.2341667,-86.2483333
9/24/1997 20:47,huffman,tx,us,teardrop,10.0,5-10 sec.s,Large object seen running N. of FM 1960 bearing W.  It was about 1&#44000 through 4&#44000&#39 feet in altitude.  Looked to be between 5-8mi awa,1/28/1999,30.0269444,-95.0855556
9/25/1997 02:00,toronto (canada),on,ca,light,900.0,15min,bright round object zig zaging back and forth up and down over lake ontario canada side.,1/11/2002,43.666667,-79.416667
9/25/1997 22:00,clearfield,ut,us,triangle,90.0,60-90 seconds,We observed a low flying craft (aprox.100yards up ) hovering over head and moving in a westerly direction. The movement was slow.,1/28/1999,41.1108333,-112.0252778
9/25/1997 23:00,toronto (canada),on,ca,light,900.0,10-15 min,reddish orange lights popping in and out of sky randomly all in different spots,2/12/2004,43.666667,-79.416667
9/27/1997 05:00,crestwood,ky,us,disk,900.0,15 minutes,A big disk with red and green lights on the rim was coming closer to the ground&#44 it&#39s body was the color of the sky.,8/5/2001,38.3241667,-85.4725
9/27/1997 23:00,egan,sd,us,other,1800.0,30 minutes,The Weirdest Thing I Have Ever Seen,2/22/2005,43.9991667,-96.6486111
9/28/1997 23:15,san francisco,ca,us,triangle,15.0,12-15s,flying-wing shape outlined by 12-14 lights. Apparent high altitude over- head east to west mvmnt.  Appx. 9-12 moon widths,7/5/1999,37.775,-122.4183333
9/30/1997 20:00,nova scotia (canada),ns,,light,10.0,8-10 seconds.,Single light resembling a star&#44 but moving spuratically downwards and sideways.,10/30/2006,44.681987,-63.744311
9/30/1997 22:00,madison,wi,us,light,300.0,5 minutes,Strange light inside Lake Monona,3/2/2004,43.0730556,-89.4011111
10/1/1997 00:00,bemidji,mn,us,triangle,600,10 minutes,In october 1997 my dad and I seen 3 lights in the shape of a triangle tumbling over each other in Bemidji Minnesota.,12/3/2004,47.4736111,-94.88
10/1/1997 01:20,garland,tx,us,rectangle,40,40 seconds,I had just got off of work at 1:15 a.m. I was driving down to the Hypermart USA because it was the only store open 24 hrs. I notice thi,11/20/2001,32.9125000,-96.6386111
10/1/1997 03:00,jefferson,ny,us,other,300,05 minutes,Rural mountain area. Tree covered hill. 1860&#39 MSL. I awoke to see a bright white light approx 1&#44500&#39 so east of my camper. The circular,10/2/1999,42.4811111,-74.6108333
10/1/1997 08:00,oregon (rural),or,,rectangle,20,20 seconds,noisy rectangular object falling from the sky and crash landed,5/15/2006,43.804133,-120.554201
10/1/1997 09:00,charlotte,nc,us,cigar,120,2 minutes,Cigar shaped&#44 silvery-white object @ 500-1&#4400&#39 up&#44 in a clear blue&#44 cloudless sky.  Object was silent&#44 immobile&#44 and when I glanced dow,1/28/1999,35.2269444,-80.8433333
10/1/1997 19:00,green bay,wi,us,light,1200,15-20 minutes,Three red lights,4/14/2009,44.5191667,-88.0197222
10/1/1997 19:00,pelzer,sc,us,triangle,180,3 minutes,Large&#44 black&#44 triangular&#44 object flew low and silent over South Carolina state prison yard.,1/10/2009,34.6422222,-82.4561111
10/1/1997 21:00,hyannis,ma,us,triangle,60,1 minute,WIFE AND I DROVE ONTO START OF OUR STREET&#44 NOTICED TWO LIGHTS NOT USUALLY THERE.  STOPPED CAR&#44 GOT OUT&#44 SAW TWO CRAFTS.  NO NOISE AND H,6/23/1999,41.6527778,-70.2833333
10/1/1997 21:30,oakland,or,us,light,60,1 minute,High altitude light turned&#44 dropped several Thousand feet&#44 turned and disappeared&#33,11/19/1998,43.4222222,-123.2972222
10/1/1997 21:30,bourbonnais,il,us,triangle,60,-1 min,I was traveling home from visiting my dad in Carle Hospital on 113 heading towards Custer Park&#44 IL. It was dark out I was in farm count,1/19/2005,41.1416667,-87.875
10/1/1997 21:55,martinsville,va,us,other,300,5 mins,Yellow/Orange lighted object moving from NE to SW. Very bright toy top shape with no sound. About the size of a penny held at arm reach,1/28/1999,36.6913889,-79.8727778
10/1/1997 22:00,summerville,sc,us,triangle,1200,20 min,Triangular shape with lights in a V&#44 no sound&#44 very slow moving.,10/30/2006,33.0183333,-80.1758333
10/1/1997 23:15,lakeland,fl,us,light,60,1 minute,3 oval shaped reddish-orange lights flew over my house&#44 heading directly south. The lights formed a perfect triangle&#44 but flying severe,1/28/1999,28.0391667,-81.95
10/2/1997 02:00,ringgold,ga,us,circle,120,2 minutes,My mother and I were driving down Alabama Hwy When a round silver shiny object appeared in My driver side window. It stayed right Besid,8/5/2012,34.9158333,-85.1091667
10/2/1997 14:00,los angeles (malibu beach),ca,us,sphere,3,3 sec,oval&#44 spheric object moving fast and straight,10/28/2002,34.0522222,-118.2427778
10/3/1997 02:00,pleasanton,tx,us,unknown,420,7 minutes,Object moved with uncertainty and vanished.,5/24/1999,28.9669444,-98.4783333
10/3/1997 21:00,jim thorpe,pa,us,oval,60,less than 1 min.,The turn was that of a very sharp L,12/9/2003,40.8758333,-75.7327778
10/3/1997 21:30,waco,tx,us,light,60,1 minute or more,Lights flying around the moon.,6/12/2011,31.5491667,-97.1463889
10/4/1997 13:00,taylorsville,ky,us,light,300,5 minutes,I observed approx. 5 small blinking lights clustered together&#44 after about 5 min. they turned off or fazed out.  These could not be see,1/28/1999,38.0316667,-85.3425
10/4/1997 18:00,warrenton,va,us,light,5,5 seconds,Bright star like oject going from south to north at extreme high rate of speed,1/28/1999,38.7133333,-77.7955556
10/5/1997 19:00,cheyenne,wy,us,other,90,1.5 min,Seen a object in clear sky.looked like commet coming from south to north.lost tail half way across sky,1/11/2002,41.1400000,-104.8197222
10/5/1997 20:30,utica,ny,us,light,120,2 minutes,I looked up at the sky&#44 and two or three bright red dots were in the sky&#44 and moving at right angles very fast.,4/1/2001,43.1008333,-75.2330556
10/7/1997 03:26,mm82/mm83 (between&#44 on i-80),pa,,circle,300,5 minutes,Driving west on i-80 ufo was hovering about 100 ft off ground less than 50 ft from interstate.It was about 200yds in diameter and the u,3/7/1998,41.203322,-77.194525
10/7/1997 20:30,twin mountain,nh,us,light,10,@ 10 seconds,FLASHING BLUE AND GREEN LIGHTS ACROSS THE SKY AND THEN IT DISAPPEARED IN A BRIGHT WHITE LIGHT.,8/16/2002,44.2722222,-71.5394444
10/9/1997 11:40,camarillo,ca,us,circle,120,2 minutes,all three of us were friends. My friend&#44(deleted)&#44 saw it first. He said &quot;What&#39s that shiny thing in the sky?&quot; I said&#44 &quot;Where? I d,1/28/1999,34.2163889,-119.0366667
10/9/1997 19:00,detroit,mi,us,triangle,300,5min.,A wedge shaped object flew over head of us as we stood on our deck in our backyard. Ther was a bright light in the middle of the ship a,1/28/1999,42.3313889,-83.0458333
10/10/1997 16:00,connersville,in,us,delta,14400,4 hours,3 differants types &#44 cluster &#44delta &#44 and one in a 3 pointed star design . followed it for six miles .,1/28/1999,39.6411111,-85.1411111
10/10/1997 17:00,mesa,az,us,sphere,30,30 seconds,A small dark purple quad-thruster craft hovering 200-300 feet in the sky. 500 Lights On Object0: Yes,2/14/2008,33.4222222,-111.8219444
10/10/1997 20:00,bonaire,ga,us,triangle,300,<5 minutes,Triangular Object Sighted at Very Close Range,2/1/2007,32.5436111,-83.5961111
10/10/1997 21:00,austin,mn,us,other,3600,1-hour,i was traveling northbound on state highway 105 approximately 8 miles south of Austin MN when an object came down directly above my car,1/28/1999,43.6666667,-92.9744444
10/11/1997 22:00,hafnarfjordur (iceland),,,sphere,300,5 min,playing with a jet,6/12/2008,64.066667,-21.95
10/12/1997 10:30,poole (uk/england),,gb,other,60,1 minute,UFO Sighted in Poole&#44 Dorset England,3/19/2009,50.716667,-2.0
10/12/1997 18:30,huntington beach,ca,us,sphere,20,20 seconds,Sphere chased by Huntington Beach Helocopter,10/20/2005,33.6602778,-117.9983333
10/12/1997 19:00,white tank mountains,az,,light,1200,20 minutes,Saw bright light past mountains. Looked at it through binoculars. It was very large. Must have been 18 or 19 miles away. Due to it&#39s si,1/28/1999,33.539166,-112.558414
10/12/1997 21:51,kenner (34th st.),la,us,disk,1260,1:21min,two disk like objects passed over me and my mother  objevts seemed to be a couple of thousand feet overhead,6/2/1998,29.9938889,-90.2416667
10/12/1997 22:30,chicago,il,us,light,300,5 minutes,Me and my friend were driving back from a Cubs game and we saw a red light in the sky it was moving very fast&#44 then stopped&#44 went back,9/19/2002,41.8500000,-87.65
10/12/1997 23:00,franklin,nh,us,other,15,15 seconds,Round green ball-shaped object,8/16/2002,43.4441667,-71.6477778
10/13/1997 05:00,ogden/clinton,ut,,circle,10800,3 hours,My husband woke me up to see this. It is hard to describe because it was inside a cloud. It had an outer ring of triangular lights that,8/5/2001,41.184944,-112.014664
10/13/1997 20:15,reno,nv,us,other,3600,60min.,We saw several objects performing naneuvers that not possible for present day aircraft to accomplish. This sighting is indescribable th,1/28/1999,39.5297222,-119.8127778
10/13/1997 22:15,hollister,ca,us,light,120,1-2 min.,I was walking on a county road looking at the stars as I often do When I noticed a star becoming brighter&#44 Then to my amazement it move,1/28/1999,36.8525000,-121.4005556
10/14/1997 16:00,syracuse (north),ny,us,unknown,30,30 sec. max,4 Military planes fly past flying rod&#44  and information blackout still ocurring.,8/5/2001,43.0480556,-76.1477778
10/15/1997 01:00,paris,tn,us,light,600,10 minutes,blue ball of light subdues me and my girlfriend.,5/24/2005,36.3019444,-88.3266667
10/15/1997 02:15,duncan,ok,us,unknown,315,05:15,This is what I can remember about my abduction.,1/28/1999,34.5022222,-97.9575
10/15/1997 03:00,atlanta (north of),ga,us,light,300,5 min,A  blue grayish kind of light.,3/7/1998,33.7488889,-84.3880556
10/15/1997 03:00,brigham city (west of),ut,us,other,180,3 min,VERY LARGE GLOWING OBJECT HOVERED TO THE WEST OF THE SALT LAKE DISAPERING AFTER ABOUT 3 MIN,9/6/2002,41.5102778,-112.0147222
10/15/1997 07:00,pasadena,ca,us,oval,30,30 seconds,it was a plasma craft . It looked just like the pics taken in mex of a plasma craft.,2/18/2001,34.1477778,-118.1436111
10/15/1997 10:00,dallas,tx,us,light,300,5 minutes,My friend and I were driving home from a date&#44 I opened the sunroof to view the moon lite sky.  As I was starring at the stars  somethi,6/2/1998,32.7833333,-96.8
10/15/1997 15:00,new york city (staten island),ny,us,cylinder,120,2 minutes?,Metallic Cylinder Moving thru New York Harbor,2/14/2008,40.7141667,-74.0063889
10/15/1997 17:30,daggett,ca,us,rectangle,8,6-8 seconds.,One very fast&#44 very low flying rectangular object changes direction&#44 stops&#44 then seperates into three equally fast smaller objects.,10/8/2007,34.8633333,-116.8872222
10/15/1997 18:40,abingdon,va,us,light,600,~10 minutes,Bristol Herald Courier run on Thursday (10-16-97) the following day &quot;Unusual lights in sky over Mountain Empire generate speculation&quot;.,8/5/2001,36.7097222,-81.9775
10/15/1997 19:00,boulder,co,us,triangle,300,5 min,Saw 3 lights moving slowly over the foothills,11/17/1999,40.0150000,-105.27
10/15/1997 19:00,shark river hills,nj,us,triangle,300,5 minutes,I was walking my dog on a dark&#44 clear evening.  I sensed a weird feeling and looked up to the sky.  Above the tree tops&#44 I couldn&#39t mak,2/1/2007,40.1938889,-74.0491667
10/15/1997 19:35,austin/eureka (between&#44 hwy. 50),nv,,light,35,35 seconds,I was driving west on hyw 50 and saw 6 bright lights 3 on a ship&#44 and then they were gone&#33,1/28/1999,39.512151,-115.982003
10/15/1997 20:00,westfeild,wi,,light,240,2-4 minutes,We were driving down the road. We saw it out of the window. we lost track of it and then saw it again whan we reached our destination.,2/16/1999,43.883595,-89.493439
10/15/1997 20:00,rosburg,wa,us,triangle,240,3-4 minutes,Triangular shaped object.,7/19/2010,46.3311111,-123.6372222
10/15/1997 20:00,bladen,ne,us,sphere,120,2 minutes,ufos on the moon????,2/24/2001,40.3222222,-98.5944444
10/15/1997 20:15,harrodsburg,ky,us,unknown,45,45 seconds,Iron-gridwork&#44 lightless&#44 silent UFO seen over central Kentucky.,12/16/2005,37.7622222,-84.8433333
10/15/1997 20:45,stephenville,tx,us,circle,600,10 minutes,Central Texas Sighting in Fall of 1997. Pulsing&#44 single craft at EXTREME SPEEDS.,1/3/2001,32.2205556,-98.2019444
10/15/1997 21:30,waldorf,md,us,light,420,7 minutes,Three circular lights fuse into one and become an intensly bright beacon,4/27/2004,38.6244444,-76.9394444
10/15/1997 22:00,alvarado,tx,us,chevron,30,30 secs,&quot;V&quot; Shaped craft over Night Sky in Alvarado TX. Oct. 1997,10/31/2003,32.4063889,-97.2113889
10/15/1997 22:00,freeport,il,us,flash,15,15 seconds,Two different reports of blinking light seen by same witness within a years time.,12/9/2000,42.2966667,-89.6211111
10/15/1997 22:00,st. louis,mo,us,unknown,60,1-minute+,inside the house&#44 but could tell it was above us,4/26/2000,38.6272222,-90.1977778
10/15/1997 23:30,fort william (uk/scotland),,,unknown,30,-30sec,UFO exploded in the West Highlands of Scotland..,2/18/2001,56.819817,-5.105218
10/15/1997 23:59,naalehu,hi,us,sphere,300,5 min.,It looked like a natural object (for a meteor) but it didn&#39t follow the laws of gravity,8/25/2000,19.0638889,-155.5858333
10/16/1997 01:30,jacksonville,fl,us,sphere,600,10 minutes,Metallic Sphere Scans My Entire Body,8/5/2001,30.3319444,-81.6558333
10/16/1997 05:34,hickory,nc,us,fireball,180,3minutes,I was outside when I saw a red &quot;fireball&quot; moving in an oval pattern.,6/23/1999,35.7330556,-81.3413889
10/16/1997 08:00,rooseville,mi,,light,60,1 minute,I was coming down the I94West ramp onto the freeway&#44 when I was eye level with the sky&#44 I looked at the clouds and there was a light as,1/11/2002,42.497258,-82.937141
10/16/1997 19:05,hollister,ca,us,light,40,40 seconds,Very dim light&#44 extreme altatude&#44 traveling from Pacific easterly aprox. over San Jose or S.F.&#44 dramatic turn to south/east toward Araz,1/28/1999,36.8525000,-121.4005556
10/17/1997 20:00,ignacio,co,us,triangle,3600,1 hour,Three triangular shapes with extended &quot;legs&quot; floating southwest over SW Colorado NW New Mexico mountains.,4/14/2009,37.1150000,-107.6325
10/18/1997 15:00,evansville,in,us,unknown,60,about 1 min.,Daughter &amp; I were fishing and when we heard &amp; saw a plane I said &quot;look honey&#44 see the plane&#33&quot; At that time somethuing appeared just beh,1/28/1999,37.9747222,-87.5558333
10/19/1997 02:00,attleboro,ma,us,light,600,10 minutes,A small globe of white light hovering over the grass paced my car for several minutes.,1/16/2014,41.9444444,-71.2861111
10/19/1997 02:00,crofton,md,us,other,7200,approx. 2 hrs.,I heard a strange noise in kitchen.I thought that my cat knocked over the trash bin again.So I whipped my silk rob on&#44 and walked down,1/28/1999,39.0016667,-76.6877778
10/20/1997 08:45,gig harbor,wa,us,light,60,30 seconds to 1 minute,I saw my first UFO when I was on my way to school as a child.,12/12/2011,47.3294444,-122.5788889
10/20/1997 20:00,round rock,tx,us,diamond,3600,1 hour or more,Major UFO event&#44 Round Rock Texas,6/4/2004,30.5080556,-97.6786111
10/20/1997 22:00,grimsby (uk/england),,gb,egg,120,2 minutes,Bright green egg shaped object hovering for some time then shot off in a nothern direction very fast,8/16/2002,53.533333,-0.05
10/21/1997 18:45,norristown,pa,us,circle,1200,20 minutes,I viewed three UFO&#39s in the sky&#44 moving at high speeds and amazing shapes in the sky not possible by human planes.,12/19/2003,40.1213889,-75.3402778
10/21/1997 22:00,bluff,ut,us,light,60,1 minute,following a green fireball&#44 a red light appeared on Comb Ridge.,2/18/2001,37.2844444,-109.5511111
10/22/1997 15:00,milford,ca,us,disk,5,5 seconds,Silver saucer shaped craft seen clearly over Sierra Nevada mountains for a short time.,11/28/2007,40.1713889,-120.3713889
10/23/1997 16:30,billings,mt,us,cylinder,180,16:30-16:33,Dark gray&#44 cylindrical&#44 object about 100m wide and 40m tall.  Hovered in circle&#44 about 20 miles away.,1/28/1999,45.7833333,-108.5
10/23/1997 21:00,orlando,fl,us,other,600,approx. 10 minutes,Rounded rectangle of a cluster of frosted raspberry lights slowly moving north&#44 then&#44 swiftly gone...,4/8/2002,28.5380556,-81.3794444
10/23/1997 22:30,weehawken,nj,us,other,4,4 seconds,Green orb without streaking&#44 incoming over Hudson River between NYC &amp; NJ. A high-speed descent that looked like it was destined to cras,1/28/1999,40.7694444,-74.0208333
10/24/1997 00:00,norfolk,va,us,circle,10,10 seconds,Green&#44 luminous round object that had a dark vertical line (or absense of light)appeared suddenly descended and disappeared.,1/28/1999,36.8466667,-76.2855556
10/24/1997 06:30,blountville,tn,us,circle,180,3 minutes,Brightly lit circular object (circular light pattern) hovering 1 1/2 minutes and suddenly darting away faster than conventional aircraf,1/28/1999,36.5330556,-82.3269444
10/24/1997 15:00,musquodoboit harbour (canada),ns,ca,other,45,45 secs +/-,H shaped craft seen in daylilght hours 9 years ago in Musquodobit Harbour area of Nova Scotia.,2/14/2006,44.783333,-63.15
10/24/1997 18:00,houston,tx,us,triangle,6,5-6  seconds,Witnessed black&#44 metallic UFO pass by airplane window at 28&#44000 feet.  Witnessed by several people in daylight.,1/28/1999,29.7630556,-95.3630556
10/24/1997 20:42,fairfield,ca,us,sphere,2,2 seconds,Round blue-green object seen hurling to earth.  It disappeared before reaching the ground.  It was only visible in the night sky for ap,1/28/1999,38.2494444,-122.0388889
10/24/1997 22:05,santa rosa,ca,us,circle,5,5 seconds,Circular object; leading edge visable and dull white;shape of crecent moon; heading nw to se; twice size of moon; no details other than,1/28/1999,38.4405556,-122.7133333
10/25/1997 21:45,minneapolis,mn,us,triangle,60,1 minute,A small V of lights moving very quickly from west to east,1/28/1999,44.9800000,-93.2636111
10/26/1997 22:00,charlotte,nc,us,triangle,2,few seconds,I spotted two triangular craft over the treetops........,8/30/1999,35.2269444,-80.8433333
10/27/1997 19:30,stoke-on-trent (uk/england),,gb,cylinder,30,30 seconds,TRANSLUCENT (V) FORMATION  OBJECTS AT CLOSE QUARTERS 1997,1/27/2005,53,-2.183333
10/28/1997 18:05,sacramento,ca,us,light,300,5 mintues,I was driving when i saw lights flashing on and off. The lights were very fast&#44 faster than a plain. When the object flew over my head,1/28/1999,38.5816667,-121.4933333
10/28/1997 18:45,willow springs,mo,us,triangle,180,3 min,triangle shaped with 5 red lights along the edge and 1 white light in the middle traveling east and low to the ground.,9/9/2004,36.9922222,-91.9697222
10/28/1997 20:15,jackson center,oh,us,light,10800,on/off 3 hours,three orange lights appear in back of our factory while on a smoke break all moving back and forth&#33&#33&#33,1/28/1999,40.4394444,-84.0402778
10/29/1997 16:30,glen alpine,nc,us,light,60,1 min.,I herd a humming sound and a bright lite. From - Thu Oct 30 14:34:07 1997 Return-Path: nobody@colorado.nwlink.com Received: from colora,1/28/1999,35.7288889,-81.7794444
10/29/1997 19:00,childress (north of),tx,us,sphere,10,10 seconds,I submitted this report last week&#44 but haven&#39t seen it posted&#44 so I thought it may have been lost in the shuffle.  Incidentally&#44 as a c,1/28/1999,34.4263889,-100.2036111
10/29/1997 19:00,childress (approx 20 miles north of,tx,,light,7,5-7 seconds,A bright light&#44 which I thought was a &quot;falling star&quot;&#44 suddenly leveled off at my altitude&#44 veered to the north&#44 then came directly at m,8/5/2001,31.968599,-99.901813
10/30/1997 07:30,pittsburgh,pa,us,disk,180,3 minutes,observed stationary disk object hovering in clear daylight about 100 feet driving nearly beneath it.,1/7/2000,40.4405556,-79.9961111
10/31/1997 00:00,nocona,tx,us,sphere,12,12 seconds,A very dim&#44 round ball of light that moved at a very high speed across the sky--much faster than a jet&#44 but slower than a meteorite.,1/28/1999,33.7866667,-97.7255556
10/31/1997 10:00,el paso,tx,us,other,120,2 minutes,I saw  what appeared papers swirling high in the atmosphere. They changed into two huge white kite like objects which then turned into,1/28/1999,31.7586111,-106.4863889
10/31/1997 22:18,santa ana,ca,us,light,120,2 min.,Saw an orange&#44 round object in the northern sky under clear conditions. Object was flickering in brightness and was moving very slowly,6/2/1998,33.7455556,-117.8669444
11/1/1997 01:30,east troy,wi,us,unknown,1800,30 minutes,My daughter was 3 and 1/2 years old at the time this occurred. It was approximately November. I arrived home from work at approx 02:30.,11/26/2003,42.7852778,-88.405
11/1/1997 03:00,bridgewater,ma,us,triangle,600,10 min,OBSERVED ONE VERY LARGE TRIANGLE WITH 5 LIGHTS TRAVELING TO THE NORTH EAST&#44 POSSIBLY IN EARTH ORBIT.,2/27/2000,41.9902778,-70.9755556
11/1/1997 06:00,newton,ga,us,light,60,1 minute,About  0600 am going to work i saw this most unusual light  from something overhead.,2/14/2006,31.3127778,-84.3358333
11/1/1997 18:30,sartoga,ca,,other,30,30 sec.,bent-bowling pin craft with no lights flies over in a north to south direction,8/12/2001,37.263832,-122.023015
11/1/1997 18:50,doniphan,mo,us,fireball,120,2 min.,2 fireballs fall from sky and light up surroundings,10/15/2002,36.6208333,-90.8233333
11/1/1997 21:35,carson,ca,us,formation,30,30 seconds,7 white lights in the form of an &quot;L&quot; traveled NW to SE seen from my backyard.  Lights perfectly spaced apart&#44 never changed formation.,1/28/1999,33.8313889,-118.2811111
11/1/1997 22:00,new york city (bronx),ny,us,light,300,5 min.&#39s,OBSERVED THREE VERY BRITE LITES FLYING ACCROSS THE NIGHT SKY.,3/7/2000,40.7141667,-74.0063889
11/1/1997 22:00,los angeles (just outside),ca,us,light,5,5 seconds,It was a green light that hovered over the horizon being very still.  After a few seconds of looking at it&#44 it dropped straight below t,3/7/1998,34.0522222,-118.2427778
11/1/1997 23:00,hua hin&#44 prachuap kirikan (thailand) (near),,,rectangle,15,15 seconds,Shape of a foot-long ruler.  Seemingly semi-transparant.  4 glowing spots (not blinking) arranged evenly accross bottom.  High and extr,4/2/1999,12.568375,99.957689
11/2/1997 00:00,houston,tx,us,light,60,a minute,3 lights in line to V formation moving southwest.One light moved erraticaly and split making 180 degree turn,8/10/1999,29.7630556,-95.3630556
11/2/1997 02:20,lyons,co,us,unknown,240,2 to 4 minutes,strange humming noise over house late at night,9/2/2005,40.2247222,-105.2708333
11/2/1997 18:50,green bay,wi,us,light,600,appx. 10 mins.,A loose formation of 3 orange non-blinking lights observed slowly crossing evening sky.,1/28/1999,44.5191667,-88.0197222
