Date,city,state,country,shape,duration (seconds),duration (hours/min),comments,date posted,latitude,longitude 
6/15/1997 18:00,columbus,oh,us,triangle,45,45 seconds,I saw a dark&#44 triangular craft gliding across the sky in Columbus&#44 Ohio.,4/27/2004,39.9611111,-82.9988889
6/15/1997 18:00,akron,oh,us,disk,7200,1-2 hours,Me and my frend saw a bright light.,2/25/2003,41.0813889,-81.5191667
6/15/1997 18:15,helsinki (finland),,,cigar,45,about half an hour,Cigar shaped objects&#44 yellow colour&#44 three crafts&#44 lights in one of the object.,8/28/2002,60.173324,24.941025
6/15/1997 20:27,swanville,me,us,light,300,5 min,It was a bunch of flashing lights almost like a strobe light,1/28/1999,44.5211111,-68.9983333
6/15/1997 21:00,seattle,wa,us,triangle,60,1 min,Saw triangle craft&#44 news report says space junk&#44 not from my angle.,6/12/2008,47.6063889,-122.3308333
6/15/1997 21:00,medford,ny,us,sphere,60,1 minute,A sphere 15-20 feet wide chasing me and blinking on and off then dissapearing. 500 Lights On Object0: Yes,5/13/2012,40.8175000,-73.0005556
6/15/1997 21:00,blaine,mn,us,unknown,20,15-20 seconds,My name is Angie and the other two people with me at the time were my sister and her friend. We were driving back from a town called Ed,12/20/2000,45.1608333,-93.2347222
6/15/1997 22:00,eagle butte,sd,us,light,2700,almost 45 mins.,lighted crafts seem to take notice of us,7/16/2006,45.0025000,-101.2330556
6/15/1997 22:00,ponte vedra,fl,us,fireball,5,5 seconds,Fast moving yellow cigar shaped fireball over heavily wooded area.,5/24/2005,30.2272222,-81.3802778
6/15/1997 22:00,olive hill,ky,us,light,10,10 seconds,Saw what I thought was a star&#44 until it moved then disappeared.,1/11/2002,38.3000000,-83.1741667
6/15/1997 22:15,irvine,ca,us,changing,10,10 seconds,Craft (looked exactly like Gulf Breeze pictures) flew along nearby hillside&#44 close enough to be seen clearly. Completly silent.,1/28/1999,33.6694444,-117.8222222
6/15/1997 23:00,unknown lake,il,,triangle,480,8 minutes,Triangle craft over Illinois highway,2/14/2010,41.898794,-87.946681
6/15/1997 23:00,sun city/menifee,ca,,fireball,600,10 minutes,Green shapes flying across west horizon above hills where other people had been saying they had seen stuff around there before.,7/5/1999,33.709188,-117.197257
6/15/1997 23:00,silver city,nm,us,unknown,30,30 seconds,the object had no nav. light and moved about in a strange pattern,7/25/2004,32.7700000,-108.2797222
6/16/1997 22:46,murphy,or,us,other,3,2 to 3 seconds,A white lighted object appeared from the South West side flew to the North and disappeared. It appeared out of nowhere and disappeared,1/28/1999,42.3477778,-123.3322222
6/17/1997 01:30,petaluma,ca,us,light,180,3 minutes,The object&#44 which was about 30 degrees above the horizon and towards the south&#44 moved. It shot from its stationary position at a speed,12/2/2000,38.2325000,-122.6355556
6/17/1997 12:00,pico rivera,ca,us,chevron,15,15sec,black&#44low flying from north to south&#44like from civic center to long beach silent&#44pencil thin very quick less then 1000ft elev.? appeard,11/9/1999,33.9830556,-118.0958333
6/17/1997 21:30,prescott,az,us,fireball,300,5 min,large&#44 bright&#44 green &quot;shooting star&quot;&#44 5 minutes later shock wave + rattling windows. seen to the south.,1/28/1999,34.5400000,-112.4677778
6/17/1997 23:15,portland (southeast),or,us,light,300,5&#44min.,Large brite white lights grouped together W/ one red light underneath.,1/28/1999,45.5236111,-122.675
6/18/1997 22:00,new albany,in,us,cigar,3,two to three seconds,the ufo was trailing the air craft,6/20/2005,38.2855556,-85.8241667
6/19/1997 02:00,gladewater,tx,us,other,1800,30 minutes,It was an overcast night when a frind and I were leaving to go out for the night when I told my friend to look up and he couldn`t beliv,1/28/1999,32.5363889,-94.9425
6/19/1997 20:15,englewood cliffs,nj,us,light,2,00:02,When I looked up a bright white light appeared. It began moving to the left and changed to a faint yellow. The light dimmed to the poin,4/2/1999,40.8852778,-73.9527778
6/19/1997 20:30,cottonwood,az,us,disk,1800,30 minutes,Disc with amber lights seen near Verde River. Disc was accompanied by other unidentified objects.,12/12/2009,34.7391667,-112.0091667
6/20/1997 00:35,sunnyside (granger&#44 on hwy 82),wa,us,light,300,5 min.,3 bright red lights clustered together&#44  at first thought airplane&#44 no running lights or no sound&#44 flew over Outlook Wa. and headed for,1/28/1999,46.3238889,-120.0075
6/20/1997 01:00,ocala,fl,us,light,300,5 minutes,It was amber orange in color glowing and pulsating behind a cloud or vapor floated very slowly and split in two,6/18/2004,29.1869444,-82.1402778
6/20/1997 01:00,san lorenzo (puerto rico),pr,us,,60,0:01min,My mother was coming back from work when outside a cementary she saw a shape of a person with big red eyes trying to follow her.,11/2/1999,18.1913889,-65.9613889
6/20/1997 01:45,black horse pike,nj,,disk,60,1 minute,While riding in the passenger seat in our conversion van with my mom driving and other siblings asleep in the back. We were driving on,11/20/2013,39.5878,-74.846472
6/20/1997 04:30,seattle,wa,us,other,0.45,00.45 sec,on leaving work at giving time noticed fivebright spots in the sky&#44 the spots were evenly spaced in a v shape&#44cloud cover was minimal&#44,1/28/1999,47.6063889,-122.3308333
6/20/1997 20:34,carefree,az,us,circle,5,5 seconds,Large round object glowing a bright green&#44 with also some yellow &amp; white light dropping to the NE from SW&#44 to near ground level at abou,1/28/1999,33.8222222,-111.9175
6/20/1997 21:00,little marsh,pa,us,triangle,180,3 min.,Darkest night sky of year&#44moon not visible.Object traveled south-north very low&#44no sound&#44slow&#44two large front facing white cicles that,1/28/1999,41.8766667,-77.4016667
6/20/1997 21:00,holland patent,ny,us,circle,5,5 sec,A bright blue light hovering over an open field.,1/29/2002,43.2416667,-75.2572222
6/20/1997 21:45,alamosa (west of),co,us,light,300,:05min,Bright silverish-white light 5 degrees above horizon with occasional red flashes&#44 appeared 50 miles North-West of Alamosa,9/6/2002,37.4694444,-105.8694444
6/20/1997 23:00,collierville,tn,us,oval,1800,25-30 minutes,Country side sighting of 4 UFOS with 4 witnesses.,11/4/2012,35.0419444,-89.6644444
6/21/1997 00:00,libertyville,il,us,disk,3600,1 hour,I saw a disc shaped object glowing with a very bright&#44 white light.  It was the brightest and softest light I have ever seen.  Even tho,9/12/1999,42.2830556,-87.9530556
6/21/1997 00:15,london (chingford hatch) (uk/england),,gb,light,4200,1hr 10mins,On leaving a restaurant awiating a Taxis&#44 We looked at the sky.It was a Full Moon that night&#44 We saw several spherical lights some of w,9/19/2002,51.514125,-0.093689
6/21/1997 09:45,phoenix,az,us,cylinder,180,2 to 3 min.s,white cylendar&#44 stationary&#44 no markings&#44 no lights&#44 no sound.,1/28/1999,33.4483333,-112.0733333
6/21/1997 11:28,ticonderoga,ny,us,triangle,300,5 min,There was a flash of blue light in the sky&#44 and then it disappeared,1/28/1999,43.8486111,-73.4238889
6/22/1997 01:00,orlando,fl,us,,30,30sec,As I walked by a brick wall about 5&#394 I saw two figures that looked like cartoon caracters . They were yellow &#44 black eyes &#44 perhaps po,8/28/2002,28.5380556,-81.3794444
6/22/1997 06:00,greensboro,nc,us,light,45,45 seconds,two lights in tandem moving NE-SW,1/28/1999,36.0725000,-79.7922222
6/22/1997 06:30,huffman/atascacita area,tx,,other,600,10 min,Long streike across the sky at high rate of speed over Lake Houston.,1/28/1999,31.968599,-99.901813
6/23/1997 01:00,willow creek campground,ca,,other,7200,2 hrs,Late in the evening&#44 just before retiring&#44 A luminous object was spotted just above a mountain&#44 and in between two trees. It appeared t,1/28/1999,39.48316,-121.041536
6/23/1997 09:30,eunice,la,us,light,600,10 minutes,Circular bright white light above house,10/31/2008,30.4941667,-92.4175
6/24/1997 01:57,san francisco,ca,us,oval,10,5-10 seconds,close oval white object transforms self to a circular green object - both had trails of same color,1/28/1999,37.7750000,-122.4183333
6/24/1997 21:00,fresno,ca,us,light,3600,1hour,western sky i observed a bright light just after the setting sun.about 9:pm,11/20/2002,36.7477778,-119.7713889
6/25/1997 09:11,phoenix,az,us,chevron,1200,15-20 minutes,An Alpha-shaped craft with a large sphere in the middle of the arms appeared at a high altitude and maneuvered for 15 minutes.,9/12/1999,33.4483333,-112.0733333
6/26/1997 18:23,pretoria (south africa),,,light,15,10-15 sec,Bright&#44 arc-white light observed moving fromWSW to ENE at high speed. Altitude roughly500 metres (1500 feet). Distance at start ofsight,1/28/1999,-25.746111,28.188056
6/26/1997 23:05,wendover (approx. 20 miles e of nv. i-80),ut,us,disk,35,35 sec.,Object flew towards us from S.E. and then parallel to us at 75 mph. Appox. 8 lights on outer circumference of disk shape&#44 only lights v,10/12/2001,40.7372222,-114.0366667
6/27/1997 00:50,gresham,or,us,triangle,120,? minute(s),Clear night &amp; sky - no other aircraft.  Saw strange lights in NE not like regular aircraft. Am trucker&#44 kept catching glimpse of lights,2/16/2000,45.4983333,-122.4302778
6/27/1997 20:00,north babylon (long island),ny,us,triangle,1215,20:15,To whom it may concern&#44 my name is((Name deleted)). On the night of June 27&#44 1997&#44 me and my friend (Deleted) saw a U.F.O.  I can tell,1/28/1999,40.7163889,-73.3222222
6/27/1997 20:30,fountain hills,az,us,other,900,15 minutes,Brother in law of MUFON Investigator sees large black object hovering stationary over mountains in the NE,1/28/1999,33.6116667,-111.7166667
6/28/1997 08:00,harvey&#39s lake,pa,,other,10800,2 to 3 hours,I may have been abducted with the time differential but have no recollection of missing time. 500 Lights On Object0: Yes,10/31/2008,41.363333,-76.043889
6/28/1997 12:00,wilcox,az,,cylinder,7200,2 hours,hovering cylinder object,8/24/2010,32.252852,-109.832012
6/28/1997 18:00,springfield,oh,us,disk,60,one minute,I was at a friend&#39s house sitting on the back patio.  The time of day was sunset&#44 although it was still bright out.  I was sitting down,1/11/2002,39.9241667,-83.8088889
6/29/1997 22:09,cave creek,az,us,triangle,900,15 minutes,One object&#44 triangular (V-shaped) with 3 yellow lights&#44 one at center of the V and one on each side at the end&#44 with red lights at each,1/28/1999,33.8333333,-111.95
6/29/1997 23:35,ballymoney&#44 antrim (uk/wales),,,unknown,180,3 minutes,glowing object moving east - west and upwad at high speed. no disernable shape it must have been about 20000 feet up it seemed to move,1/28/1999,55.064948,-6.498239
6/29/1997 23:45,farmington (approx. 3 miles n of),nm,us,unknown,180,3 minutes,Saw what appeared to be two satellites flying in formation&#44 but don&#39t believe that objects were satellites or airplanes.,11/20/2002,36.7280556,-108.2180556
6/30/1997 00:30,chitik lake (canada),sk,,light,45,45 sec,chitik lake canada day,1/17/2004,53.753361,-107.734453
6/30/1997 01:00,bigfork,mt,us,triangle,20,20 seconds,I woke up balf a sleep shook x-husband said do you see the light? he raised up half way said &#39ya&#39 and he fell back to sleep i looked at,3/11/2006,48.0633333,-114.0716667
6/30/1997 05:45,venice,fl,us,cigar,600,10 minutes,&quot;Bouncing Ball&quot; follows car in Venice Florida,7/28/2010,27.0994444,-82.4544444
6/30/1997 06:00,camarillo,ca,us,circle,1800,30 minutes,1997 Camarillo&#44 Calif.  huge bright light moved at a fast rate of speed then hovered over my car then disappeared. 30 min. pos. 5/31/06,7/16/2006,34.2163889,-119.0366667
6/30/1997 12:00,salisbury,nc,us,light,10,10 seconds,Shining like a sparkler and brighter than the sun in broad daylight.,2/27/2014,35.6708333,-80.4744444
6/30/1997 12:00,anchorage,ak,us,cylinder,900,15 minutes,Walking dog in the day and saw a silent and still chrome cylindrical object in the sky.,3/13/2012,61.2180556,-149.9002778
6/30/1997 20:22,port perry (canada),on,ca,light,3600,1 hour,UFO Air Show?,1/10/2009,44.1,-78.933333
6/30/1997 21:00,fort smith,ar,,light,3600,hours for several nights,Colored&#44 dimming&#44 stat. light source&#44 larger than stars seen at night SW of Fort Smith&#44 AR&#44 1996-1997.,4/18/2012,35.385924,-94.398547
6/30/1997 23:00,tijeras,nm,us,cigar,120,2 minutes,steadily moved across the sky &amp; then hovered&#44 2x&#44 creating a triangle formation &amp; then dissapearing.,7/5/1999,35.0808333,-106.3875
7/1/1997 00:00,freehold,nj,us,light,5,5 seconds,Strange Orange Light,3/17/2004,40.2600000,-74.2741667
7/1/1997 01:30,kilgore,tx,us,circle,5,5 seconds,Two police officers&#44 out on a hunting expedition&#44 witness a dramatically bright &quot;fireball&quot; close to their position.,8/19/2012,32.3861111,-94.8755556
7/1/1997 01:30,kilgore,tx,us,circle,5,5 seconds,Dear Sir&#44  In reference to the sighting in east texas.  I spoke with with my friend y((name deleted))  (903 XXX-XXXX).,8/19/2012,32.3861111,-94.8755556
7/1/1997 10:30,langley (canada),bc,ca,fireball,900,5-15mins,The object appeared to be a extemly radiant sphere yellow in color.  It hovered then dissapeared suddenly.,12/2/2000,49.1,-122.65
7/1/1997 13:00,albion,pa,us,cigar,900,15 minutes,Was silent&#44 seen by two customers of mine&#44 who are not UFO buffs,1/28/1999,41.8905556,-80.3666667
7/1/1997 15:20,omaha,ne,us,disk,60,1 minute,UFO sighted in plain daylight cruising at low altitudeand without audible sound in Omaha.,1/28/1999,41.2586111,-95.9375
7/1/1997 18:00,hamilton,nj,us,other,180,3 minuts,sighting in NJ,10/8/2007,40.5061111,-74.6205556
7/1/1997 18:00,new york city (manhattan),ny,us,sphere,60,1 min,Black sphere hovering over lower Manhattan.,10/11/2005,40.7141667,-74.0063889
7/1/1997 21:00,kingston,ny,us,disk,180,3 mins.,A bright saucer UFO rose up from behind distant woods&#44 turned left and glided out of sight.,10/8/2007,41.9269444,-73.9977778
7/1/1997 23:00,willow creek,ca,us,sphere,300,5 minutes,Blue orb appears out of nowhere&#44 lights up huge area&#44 and then sets behind my house on mountain-side.,2/18/2013,40.9397222,-123.6302778
7/2/1997 21:00,davenport,ca,us,circle,4,3-4 sec,Traveling northbound on hwy 1 towards Davenport from Santa Cruz I noticed a white circular or round glowing object out the driverside w,11/20/2002,37.0116667,-122.1908333
7/2/1997 21:00,petaluma,ca,us,changing,9000,2.5 hours,We saw and followed a bright light for quite a number of miles on a summer evening in July of 1997.,5/24/1999,38.2325000,-122.6355556
7/2/1997 21:15,rachel,nv,us,sphere,2700,45 minutes,Orange balls of light in sky&#44 1 to 4 balls visible at a time&#44 multiples were in row. Lights materialized&#44 one at a time&#44 then slowly fa,1/28/1999,37.6447222,-115.7427778
7/2/1997 21:30,calistoga (knights valley),ca,us,triangle,1200,15 mn,A Large triangular aircraft passed silently overhead. It had 4 lights in front&#44 a bright light underneath&#44 a wavelike column of yellow-,11/19/1998,38.5788889,-122.5786111
7/2/1997 23:30,boonville,mo,us,light,1800,30 minutes,Craft was spotted in the summer night sky.,6/12/2008,38.9736111,-92.7430556
7/3/1997 00:00,pullman,wa,us,rectangle,300,5 minutes,Very long recatangle body that rose to form a triangle.  It had about 5 huge white lights similar to an aircraft on one end.  At the ot,1/22/2000,46.7313889,-117.1786111
7/3/1997 03:00,brentwood,tn,us,cylinder,6,6 seconds,Extremely bright white cylinder looking object east to west direction saw from horizon to horizon through trees,9/26/1998,36.0330556,-86.7827778
7/3/1997 21:30,vanleer,tn,us,formation,2700,45 mins,Three orange yellow lights in a tri-angle pattern&#44that stayed on for about 45 mins. changed positions vertically. out for 4 or 5 mins&#44,9/26/1998,36.2350000,-87.4438889
7/3/1997 22:00,fennville,mi,us,sphere,300,5 minutes,white sphere witnessed over treeline from the shore of Lake Michigan,6/12/2007,42.5938889,-86.1016667
7/3/1997 22:30,lexington,ky,us,triangle,120,less than two minutes,I saw a triangular aircraft moving slowly and noislessly East to West.,4/2/1999,37.9886111,-84.4777778
7/3/1997 23:00,bochum (germany),,de,triangle,120,ca. 2min,Triangular formation of lights in the sky,4/2/1999,51.483333,7.216667
7/3/1997 23:00,harbor springs,mi,us,oval,180,3 minutes,It was a large oval shaped object with white lights (surrounding) moving in a circular motion.,8/5/2001,45.4316667,-84.9919444
7/4/1997 03:30,lake tawakine,tx,,other,9000,2.5 hrs,object looked like a  frying pan .the lights that formed handle were constant.the lights that formed the pan were flashing and changing,9/26/1998,32.858805,-95.95154
7/4/1997 13:00,long beach,ca,us,egg,120,2 minutes,egg shape UFO sppoted 4th of Jul 1997 Stainless steal reflective in color about 13:00 hours hovering,9/2/2005,33.7669444,-118.1883333
7/4/1997 16:00,san diego,ca,us,cigar,480,8 minutes,On July 3 1997 my 2 brothers and I saw a cigar shape going northwest it lasted a few min.,10/7/2003,32.7152778,-117.1563889
7/4/1997 16:00,st. paul,mn,us,sphere,35,35 seconds,&quot;Chrome&quot; ball over the cliffs of St. Paul,4/28/2001,44.9444444,-93.0930556
7/4/1997 19:00,evansville,il,us,circle,5,5 seconds,Every year on july 4th we attend a large party which when it gets dark&#44 fireworks are set off all evening.  The number of people there,4/25/2002,38.0902778,-89.9383333
7/4/1997 20:00,knob lick,mo,us,light,3,3 seconds,I was sitting at the closing campfire at S-F scout ranch. about mid way through my self and everyone else there saw a brillient blue li,9/26/1998,37.6752778,-90.3672222
7/4/1997 20:00,earth city,mo,us,cigar,5,5 seconds,MANY PEOPLE REPORTED  THIS THEN IT WAS HUSHED UP,3/4/2008,38.7688889,-90.4680556
7/4/1997 20:00,troy,il,us,circle,5,5 seconds,It was something not from this world.,4/14/2009,38.7291667,-89.8830556
7/4/1997 20:30,st. charles,mo,us,light,5,5 seconds,We were at a local fireworks display.  Just before dusk&#44 I looked up in the sky with my son and saw a large green object shooting acros,9/26/1998,38.7838889,-90.4811111
7/4/1997 21:00,belleville,il,us,light,5,3-5 seconds,WHILE WATCHING MOVIE AT DRIVE-IN THEATER&#44 THE ENTIRE AREA LIT UP FOR SEVERAL SECONDS WITH A BLUE-GREEN LIGHT.,9/26/1998,38.5200000,-89.9838889
7/4/1997 21:00,millstadt,il,us,light,5,5 seconds,MISSOURI INVESTIGATORS GROUP Report:  We were in the back yard in IL (USA) and we saw a blue light right at the roofline.,12/12/2009,38.4613889,-90.0916667
7/4/1997 21:00,phoenix,az,us,cylinder,180,2-3 min,a large black object kind of like a shadow passed over head while we were waiting for the fire works to start,5/14/2002,33.4483333,-112.0733333
7/4/1997 21:00,troy,il,us,light,4,3-4 seconds,large blue light silently travelling across the sky in a purposeful manner.,7/5/2005,38.7291667,-89.8830556
7/4/1997 21:10,lonedell,mo,us,delta,60,60 seconds,Ice blue object&#44 resembling an &quot;<&quot; flying south to north,9/26/1998,38.3080556,-90.8275
7/4/1997 21:15,st. charles (outside of st. louis),mo,us,sphere,5,5 seconds,St. Charles&#44 MO&#44 before fireworks show. A blue ball (??) of lightstreaked across the sky&#44 I&#39d say east to west. There was no noise.It j,9/26/1998,38.7838889,-90.4811111
7/4/1997 21:15,st. charles,mo,us,light,2,few seconds,Observed a blue-green light crossing the skyfrom Northeast to Southwest (paralleling theMissouri River).,9/26/1998,38.7838889,-90.4811111
7/4/1997 21:15,scottsdale,az,us,,900,approx 15 min,A bright red object was seen traveling from west Phoenix to east TempeSpeed was slow (probably too slow for most aircraft)&#44 it also app,7/17/2011,33.5091667,-111.8983333
7/4/1997 21:15,plymouth,wi,us,light,2700,45 minutes,Large v-shaped lights over fireworks display. Very high up.Sat still for 40 min. Began to move slow for 1 min.&#44 then streaked away VERY,9/26/1998,43.7486111,-87.9769444
7/4/1997 21:15,oakville,mo,us,light,10,10 seconds,BRIGHT OBJECT OVER HEAD MOVING WEST . GREENISH COLOR  MOVING SLOW AND THEN TAKES OFF FAST WITH A  LONG TAIL. THEN DISSAPPEARED MOVING,9/26/1998,38.4700000,-90.3044444
7/4/1997 21:15,elmwood,il,us,light,10,less than 10secs.,Unusual object descended from clouds. Not a firework&#44 never came up from the ground.,9/26/1998,40.7777778,-89.9663889
7/4/1997 21:15,granite city,il,us,light,900,15 minutes,Fourth of july celebration.,9/26/1998,38.7013889,-90.1486111
7/4/1997 21:15,st. louis,mo,us,light,1,1 sec.,Rapidly moving blue-green in sky over fireworks spectators,9/26/1998,38.6272222,-90.1977778
7/4/1997 21:15,mark twain lake&#44 monroe city,mo,,light,15,15 seconds,Adults + children sitting on lake bank awaiting fireworks&#44see a bright blue ball streak fast across skyline&#44 decend andseemingly to go,9/26/1998,39.509255,-91.768487
7/4/1997 21:15,des peres,mo,us,light,180,3 min,I was getting ready to go to a friends house. Me and my friend noticed that there was a strange blue glow that illuminated us to the po,6/4/2004,38.6008333,-90.4327778
7/4/1997 21:15,coldwater (approx. 3 miles se of),mo,us,light,4,3-4  seconds,Blue/Green light with a white trailing tail traveling East to West,9/26/1998,37.3033333,-90.4097222
7/4/1997 21:18,chesterfield,mo,us,light,2,2 seconds,Above us a bright bluish light appeared which lit up the sky then diminished to nothing.,9/26/1998,38.6630556,-90.5769444
7/4/1997 21:20,arnold,mo,us,light,2,1 - 2 seconds,greenish streak traveled east to west.,9/26/1998,38.4327778,-90.3775
7/4/1997 21:25,olney,il,us,light,2,2 seconds,Object flashed overhead&#44 bright blue/green,9/26/1998,38.7308333,-88.0852778
7/4/1997 21:30,st. charles,mo,us,light,2,2 seconds,Bright blue-green ball. From North East travelling towards south west. Almost directly overhead. Duration less than 2 seconds&#44 about 15,9/26/1998,38.7838889,-90.4811111
7/4/1997 21:30,hazelwood,mo,us,oval,5,3-5 sec,Green&#44 half-capsule shaped object&#44 streaking North-South across the sky. Disappeared half-way across.,9/26/1998,38.7713889,-90.3708333
7/4/1997 21:30,florissant,mo,us,light,10,10 secs ?,bright blue and white light traveling across the sky from east to west.,9/26/1998,38.7891667,-90.3225
7/4/1997 21:30,creve coeur,mo,us,light,0.5,0.5 sec.,During fireworks display I was looking at the sky and saw a blue/white disk-shaped object traveling east-to-west.,9/26/1998,38.6608333,-90.4225
7/4/1997 21:30,auburn,wa,us,triangle,60,1 minute,we were outside lighting fireworks when way up in the sky we saw a triangular shaped &quot;thing&quot; that had lights. It was going very very sl,9/26/1998,47.3075000,-122.2272222
7/4/1997 21:30,belleville (3.5 sw of scott afb),il,us,light,2,seconds,Royal Blue light moving very fast&#44 east to west almost directly overhead. Small teardrop shape.,9/26/1998,38.5200000,-89.9838889
7/4/1997 21:30,crestwood (near st. louis),mo,us,light,20,15-20 seconds,My wife and I were on our deck watching the fireworks display at Webster Groves Recreation Center&#44 about a mile from our location. A br,9/26/1998,38.5569444,-90.3816667
7/4/1997 21:30,hazel park,mi,us,oval,900,15 minutes,strange huge craft appears over the sky. 1997,1/21/2008,42.4625000,-83.1041667
7/4/1997 21:30,florissant,mo,us,light,2,1 to 2 seconds,Several of us had just finished watching the 4th of July fireworks when we saw a bluish/green light streak across the sky.,9/26/1998,38.7891667,-90.3225
7/4/1997 21:30,st. louis,mo,us,light,1,~1 sec,~21:30 4 July&#44 a blue light moving in a straight line passed from east to west over the Mississippi river. Duration of event was ~1 sec,9/26/1998,38.6272222,-90.1977778
7/4/1997 21:30,st. louis,mo,us,light,5,5 sec,Blue light that shot across the sky horizontally.,9/26/1998,38.6272222,-90.1977778
7/4/1997 21:30,gerald,mo,us,light,10,5 to 10 sec.,A brite blue light appeared out of nowhere. And shot across the sky.,9/26/1998,38.3997222,-91.3305556
7/4/1997 21:30,troy,mo,us,light,3,2-3seconds,We were at the Fairgrounds wating for the fireworks display to start when a light in the sky caught my eye.,9/26/1998,38.9794444,-90.9805556
7/4/1997 21:35,millstadt,il,us,light,3,3 sec,blue light traveling due west ended in red flash appeared to be close overhead. I think it was space junk or meteor due to similar sigh,9/26/1998,38.4613889,-90.0916667
7/4/1997 21:35,fairview heights,il,us,light,2,2 seconds,A blue light seen overhead moving east to west&#44very fast.It was not fireworks.,9/26/1998,38.5888889,-89.9902778
7/4/1997 21:40,collinsville,il,us,light,4,3-4 seconds,A blue light streaked across the sky at high speed for a couple seconds.  It was accompained by a crackling of burning sound.,9/26/1998,38.6702778,-89.9844444
7/4/1997 21:45,millstadt,il,us,light,5,5 seconds,BRIGHT BLUEISH BALL OF LIGHT WITH TAIL&#44 ILLUMINATED A 2000 SQ.FT. AREA FOR ABOUT 5 SECONDS.,9/26/1998,38.4613889,-90.0916667
7/4/1997 21:45,east alton,il,us,light,7,5 - 7 seconds,We saw a bright blue-green object streak across the southern sky at a great rate of speed&#44travelling from east to west.,9/26/1998,38.8802778,-90.1111111
7/4/1997 21:45,lenzburg,il,us,light,5,3-5 seconds,Blue ball moving east to west lasting 3 -5 seconds then disappearing. Lit up surrounding area.,5/14/2002,38.2872222,-89.8172222
7/4/1997 21:45,desoadoamd house springs,mo,,light,120,2 mins both times,it was a bright blue light in the sky thta was flying slowlyand then it just shot off &#44the corlos changed blue to green and desaperad.,11/20/2002,38.408943,-90.570125
7/4/1997 21:45,brighton,il,us,light,10,10 seconds,While shooting fireworks&#44 saw a bright blue object move horizontilly from east to west across the field in the back of the house.,9/26/1998,39.0397222,-90.1405556
7/4/1997 21:45,belleville community college,il,,light,5,3 to 5 sec,During fire works display the blue object moved in the southern sky from east to west. Most people my have taken it for a miss fired fi,9/26/1998,38.51759,-89.928972
