Date,city,state,country,shape,duration (seconds),duration (hours/min),comments,date posted,latitude,longitude 
1/1/1969 20:00,farmerville,la,us,other,120,2 minutes,Five bright white&#44 small balls jumped out of the sky&#44 and bounced across the road.,7/5/1999,32.7733333,-92.4055556
1/8/1969 21:30,pittsburgh,pa,us,other,300,5 minutes,Flat black color&#44 6-legged&#44 toy jack shaped&#44 basketball-sized object on the ground melting snow in a squall,11/11/2013,40.4405556,-79.9961111
1/15/1969 23:00,miami,fl,us,sphere,900,15 min. plus,Sphere&#39s appear in the room within touching distance and stay for a considerable amount of time.,12/2/2000,25.7738889,-80.1938889
1/20/1969 19:00,lake wales,fl,us,disk,300,5 minutes or so,The ufo used simulated police lights to pull me over and then just sat there apparently observing me.,12/2/2000,27.9011111,-81.5861111
2/12/1969 23:30,wildflecken (germany),,de,cigar,300,5 min.,During a training excerise @ the US Army training center @ Wildflecken &#44germany;at appx. 23:30 hours&#44 at an elevation appx.8k ft. alt.,3/6/2001,50.366667,9.916667
2/15/1969 22:00,monroe,in,us,sphere,20,15-20 seconds,Orange sphere or ball on US 27 in Monroe&#44 In at Coppus Corners,12/9/2003,40.7450000,-84.9369444
3/1/1969 00:00,omaha,ne,us,oval,30,thirty seconds,Football shaped glowing orange light drifts straight across sky&#44 west to east&#44  to the top of a very tall TV tower and then disappears,12/12/2011,41.2586111,-95.9375
3/1/1969 15:00,oak lawn,il,us,disk,1800,30 min,2 Large UFOs seen by my brother and his driving instructor,1/19/2005,41.7108333,-87.7580556
3/1/1969 21:00,perth amboy,nj,us,light,120,2 minutes,While observing Venus through telescopes&#44 my friend and I saw several lights at high altitude that were able to come to complete stops&#44,6/20/2005,40.5066667,-74.2658333
3/15/1969 11:00,oroville,wa,us,cross,120,2min,3 to 4 ft long&#44gun metal color&#44very load shook home and us&#44could sit still above us&#44was seen two years,2/14/2010,48.9391667,-119.4344444
3/15/1969 21:00,little axe,ok,us,cigar,60,1 minute,Object&#44 time loss&#44 body marks&#44,8/5/2012,35.2325000,-97.2122222
4/1/1969 07:00,loganville,ga,us,cigar,15,15  sec,Cigar shaped silver object larger than schoolbus&#44 witnessed by kids and bus driver,3/19/2009,33.8388889,-83.9008333
4/21/1969 16:30,little rock,ar,us,cylinder,720,12 minutes,Non moving&#44 soundless &#44 tri-cylinder&#44 object that appears and just fades back into sky,11/9/2002,34.7463889,-92.2894444
5/1/1969 05:00,youngstown,oh,us,disk,1800,30min,woke one morning and for no good reason went to back door and witness a saucer above trees and below on ground a small saucer a unknow,2/22/2002,41.0997222,-80.6497222
5/1/1969 12:00,san diego  (u. s. naval base),ca,us,oval,900,15min,were on lunch break from navy school. saw a small white cloud and then a object caom out of it. then another came out. then flew straig,10/19/1999,32.7152778,-117.1563889
5/1/1969 20:00,wheaton,md,us,disk,30,30 seconds,large saucer-shaped  object sighted in Wheaton&#44 MD in late 1960&#39s,1/29/2002,39.0397222,-77.0555556
5/1/1969 22:00,estill,sc,us,cigar,2700,45 minutes,shining object frightens SC family,2/14/2006,32.7547222,-81.2422222
5/15/1969 14:00,st. louis,mo,us,cigar,120,2min,1969 forest park &#44 cigar &#44  brownish gray color     went of to the west,2/14/2008,38.6272222,-90.1977778
5/15/1969 20:00,dallas,tx,us,light,60,1 minute,A light came toward us and stopped directly overhead.  It stayed there a couple seconds then shot off very fast.  No noise.,4/15/2000,32.7833333,-96.8
6/1/1969 01:00,boulder,co,us,other,300,5mins,This object looked like a bright star&#44 zig-zagging&#44 abruptly stopping &amp; then zig-zagging @ a high rate of speed above Boulder&#44 Colorado,8/5/2001,40.0150000,-105.27
6/1/1969 03:00,wacousta/dewitt (near),mi,,sphere,300,5 min.,Glowing orange sphere,2/1/2007,42.863682,-84.700817
6/1/1969 12:00,la puenty,ca,,formation,1800,30min,ufo seen over school by entire school.,12/2/2000,34.020011,-117.949508
6/1/1969 12:00,kyle,tx,us,oval,180,3 minutes,Large lemon shaped object crossed highway 35 .Car died&#44 then object exploded about 1\2 mile away extremely bright white light no noise,11/1/1998,29.9888889,-97.8769444
6/1/1969 12:00,sarasota,fl,us,light,10,10 seconds?,3 gold balls gather&#44 split to 5 and disappear&#33,12/12/2011,27.3361111,-82.5308333
6/1/1969 12:09,barrington,il,us,sphere,7200,2 hours,((HOAX??))  shiny light and elecromagnetic energy.,7/5/2008,42.1538889,-88.1361111
6/1/1969 13:00,highwood,mt,us,disk,900,15 minutes,Black disc floating towards Great Falls.,2/3/2012,47.5836111,-110.7894444
6/1/1969 14:00,oahu (400 miles nw of),hi,,light,1500,25+ minutes,My UFO report&#44  Serving as lookout on a Navy Radar Picket ship (DE) USS Durant&#44 I spotted a pinhead of very bright light overhead. I no,6/12/2008,21.438912,-158.000057
6/1/1969 17:00,highwood,mt,us,disk,1800,30 min,Black disc floating towards Great Falls with bright spotlight.,2/3/2012,47.5836111,-110.7894444
6/1/1969 18:45,falls church,va,us,other,1800,30 minutes,round plate like structure,8/5/2001,38.8822222,-77.1713889
6/1/1969 21:00,hwy 77 (along king ranch),tx,,unknown,360,6 minutes,White Lights Following Vehicle Along HWY 77.,4/12/2013,33.188251,-94.395153
6/1/1969 21:00,lawrenceburg,ky,us,disk,300,5 minutes,It was a full moon when my brother and I observed 100 yards away for 5 minutes above the tree topics a metalic saucer shaped craft with,5/15/2006,38.0372222,-84.8966667
6/1/1969 21:00,sausalito,ca,us,unknown,900,15 minutes,friend and I were walking between the edge of Richardson bay and highway 101. Must have been between 9 PM and Midnight. it was foggy&#44,1/21/2008,37.8591667,-122.4841667
6/1/1969 22:00,akron,oh,us,light,10,10 seconds,Aerial light makes turns not possible for aircraft.,7/4/2012,41.0813889,-81.5191667
6/1/1969 22:00,athens,ny,us,rectangle,180,3 minutes,Rectangle shaped object was huge dark colored with some white lights. Oddly quiet and fast.,1/16/2014,42.2602778,-73.81
6/1/1969 22:00,surrey (canada),bc,ca,other,2100,35 min,4 lites very far apart went from one part of the sky to the other fast,12/2/2000,49.136353351,-122.821343315
6/1/1969 23:00,orangevale,ca,us,unknown,2700,30 to 45 minutes,UFO over Orangevale&#44 CA in May/June 1969,5/15/2006,38.6786111,-121.2247222
6/4/1969 01:00,chance,md,us,disk,300,5 min,AN DISK SHAPED CRAFT ON THE EASTERN SHORE OF MARYLAND,7/25/2004,38.1719444,-75.9413889
6/5/1969 07:00,windsor,sc,us,disk,1800,30mint,what was this? ufo or NO ? No doubt a ufo back then.&#44.,1/31/2004,33.4816667,-81.5138889
6/5/1969 19:00,rio piedras (puerto rico),,,unknown,900,15 min.,2 lights moving oddly in the night sky,4/16/2005,18.399722,-66.05
6/10/1969 01:00,portland,or,us,disk,180,3 min,WE WERE CLOSE  ENOUGHT TO THROW ROCKS AT THEM  WE WERE CONCERNED THAT THEY SEEN US I WAS SCARED,8/5/2001,45.5236111,-122.675
6/10/1969 18:30,north wildwood,nj,us,triangle,180,3 minutes,Red Lighted Triangle landing in North Wildwood back bay area,2/14/2008,39.0005556,-74.7997222
6/10/1969 22:00,whitmore lake,mi,us,light,300,5 minutes,star like object moving in a east to west directions suddenly stops. Watch object for about 30 secounds when a smaller light drops from,1/7/2000,42.4394444,-83.7438889
6/11/1969 20:00,port hope (canada),on,ca,sphere,300,5 minutes,After seeing bright globe over uranium re finery float slowly over Lake Ontario&#44 the object suddenly accerated extremely fast diminishi,12/2/2000,43.95,-78.3
6/14/1969 23:00,land o&#39lakes,fl,,disk,60,1 minute,glowing red cup &amp; saucer shaped object near tower &amp; drexel road,12/7/2006,28.198096,-82.432994
6/15/1969 06:00,islip,ny,us,other,1200,20 minutes,Sightings/Multiple witnesses,3/31/2008,40.7297222,-73.2108333
6/15/1969 07:00,grang junction colorado,co,,disk,120,2 minutes,Me and brother were walking to the book store on main street and we heard a whistle sound coming from above . We looked up there and sa,11/11/2013,39.063871,-108.550649
6/15/1969 15:00,little rock,ar,us,cylinder,60,1 minute,no sound or lights,6/10/2003,34.7463889,-92.2894444
6/15/1969 19:00,altoona,pa,us,other,600,10 minutes,Space ship hovered with colored lights going around not flashing just circling the ship,5/29/2011,40.5186111,-78.395
6/15/1969 20:00,bryan,tx,us,triangle,60,1 min,the lights of the first craft turned back on and 2 more identically lighted aircraft zipped in on both sides of the lead aircraft ...&#44,7/5/2005,30.6741667,-96.3697222
6/15/1969 23:50,fairfax,va,us,oval,60,1 minute,Huge blimp-like craft; lights around the middle of craft; no sound; hovering above the highway.,11/2/1999,38.8461111,-77.3066667
6/21/1969 23:00,ronkonkoma,ny,us,unknown,3600,1 hour,A unidentified craft with multi-colored lights that hovered silently and could move at Incredible speeds&#44,10/11/2005,40.8152778,-73.1127778
6/25/1969 00:00,moline,il,us,unknown,900,15 minutes,True Storys of UFO&#39S 1968 LIGHT &amp; 2ND STORY UFO WAS DULL SILVER IN COLOR IN 1977&#44 1978&#441979,10/25/2011,41.5066667,-90.515
6/30/1969 00:00,kyle,tx,us,oval,180,3 minutes,object expoded  before hitting the ground in 1969 near San Marcos Texas.,10/30/2006,29.9888889,-97.8769444
6/30/1969 00:00,dorood (iran),,,sphere,900,15 min.,While riding home at night  my family and I saw an object like moon in sky,2/14/2008,33.495503,49.063174
6/30/1969 10:00,westphalia,in,us,egg,3600,1hr,ret. mst. u.s.a.f,2/8/2005,38.8627778,-87.2255556
6/30/1969 12:00,christmas valley,or,us,disk,300,5 min.,We saw three silent silver colored disks  zoom in from different directions&#44  instantly stop&#44 hover &#44 and then zip off.,12/16/2005,43.2363889,-120.6358333
6/30/1969 15:00,detroit,mi,us,light,30,30 seconds,We were under brilliant illumination that was much brighter than the 2:30 pm afternoon clear day sunlight.,12/12/2009,42.3313889,-83.0458333
6/30/1969 18:00,indianapolis,in,us,disk,1200,20 min.,Large silver sphere/saucer-shaped object that hovered for several minutes. Emitted dots (in data-style format) from side.,2/1/2007,39.7683333,-86.1580556
6/30/1969 19:25,durban (south africa),,,changing,40,40seconds,1969 Durban sighting,4/14/2009,-29.85868,31.02184
6/30/1969 22:45,somerset (uk/england),,gb,cone,25248000,8 years,First time it was a bright light and missing time frome 10.45 untill 4 in morning with no real idea why. Second time parked up in same,8/5/2009,51.083333,-3.0
7/1/1969 15:00,bristol,ct,us,unknown,10,10 seconds,My friend and I were riding bicycicels. I looked straight up and obserevd a UFO 100ft.above us. It wasabout 30 ft. in dia. It was cover,6/2/1998,41.6716667,-72.9497222
7/1/1969 16:00,issaquah,wa,us,disk,60,1 minute,Issaquah&#44 WA sighting - summer 1969,4/16/2005,47.5302778,-122.0313889
7/1/1969 18:00,scottsdale,az,us,,120,1 to 2 minutes,my brother&#44 several neighbors and I were playing outside when we all noticed a fast light streak really high up on the sky&#44  near the s,2/1/2007,33.5091667,-111.8983333
7/1/1969 18:00,whittier,ca,us,disk,420,7 minutes,In the summer of 1969 living in Starlight Estates located in Whittier&#44 California and overlooks the city of Whittier.  Around 6:00 PM (,2/16/2000,33.9791667,-118.0319444
7/1/1969 20:00,new york mills,mn,us,disk,1800,30 minutes,30 Minute Encounter with Hovering Saucer 300 Yards Away,11/26/2003,46.5180556,-95.3758333
7/1/1969 20:00,payson,az,us,disk,300,< 5 min.,The disc illuminated bright lemon yellow light through it&#39s large square windows&#44 moving slowly and beeping intermitingly,12/7/2006,34.2308333,-111.3244444
7/1/1969 22:15,chambers county (area of al-ga line),al,us,circle,300,05 minutes,MUFON/GEORGIA FOLLOW-UP REPORT:  Two hovering circles of light(s)/objects,4/26/2000,33.2416667,-87.1580556
7/4/1969 10:30,lakewood,co,us,other,300,5 mins,Light reversing directions silent - watched for ten minutes,1/12/2012,39.7047222,-105.0808333
7/4/1969 11:15,sunnyvale,ca,us,disk,10,5-10 sec.,Two fast and low disks haulin&#39 a**,5/27/2003,37.3688889,-122.0352778
7/4/1969 13:45,cachuma lake,ca,,other,900,15 minutes,Summer 1969 in California&#39s Cachuma Lake campgrounds 2 friends and I rented a boat.While sitting in the back of our rented boat wit,10/27/2004,34.578953,-119.948035
7/4/1969 20:00,jacksonville beach,fl,us,other,180,3 minutes,Very odd Flying-V object flew directly over me.,7/25/2004,30.2944444,-81.3933333
7/5/1969 10:30,march afb,ca,,triangle,300,5 minutes,Me and my brother and a buddy were camping out side at march air base and it came over the top of us it was biger then 2 blocks it did,11/19/2012,33.898889,-117.276389
7/5/1969 10:53,valdez,ak,us,disk,1020,17 minutes,Orange water,10/31/2003,61.1308333,-146.3483333
7/7/1969 22:00,fresno,ca,us,other,120,2 min,30 years ago large ufo with stinger like object emitting sparks then sped away.,10/31/2003,36.7477778,-119.7713889
7/7/1969 23:00,brainerd,mn,us,triangle,20,20 seconds,While picking up hay bales at night&#44 I saw a triangular shaped object speed through the night sky.,2/18/2001,46.3580556,-94.2005556
7/7/1969 23:30,miami,fl,us,light,20,hour,multi-colored swirling illuminating lights (looked like a tornado in the sky)  500 Lights On Object0: Yes,6/12/2008,25.7738889,-80.1938889
7/10/1969 12:00,salt lake city,ut,us,circle,2100,35mins,the craft were moving very slowly and was low just over the top of buildings.,9/15/2005,40.7608333,-111.8902778
7/10/1969 21:00,chariton,ia,us,circle,300,5 min.,It was disk shaped and brilliant white on the bottom&#44flew at a high rate of speed and changed direction at 90 degree turns.,2/14/2006,41.0138889,-93.3063889
7/11/1969 21:00,whitemarsh,pa,us,fireball,180,3 min.,Three minutes hovering silent&#44 orange-red fireball 10 feet across 400 feet high and the vanished,5/12/2009,40.1219444,-75.2169444
7/14/1969 19:00,bridgeport/lakeport,ny,,cigar,300,5 minutes,July 1969&#44 two of my friends and I saw a cigar-shaped craft hovering above  the tree-tops near my friend&#39s family home.,1/31/2011,43.145346,-75.871858
7/15/1969 00:00,south glens,ny,,flash,600,5 or 10 mins,Thats When I started to belive,2/14/2006,43.299239,-73.635117
7/15/1969 01:00,geneseo (outside of),il,us,unknown,1200,10-20 minutes,Questionable Abduction,3/31/2008,41.4480556,-90.1541667
7/15/1969 02:00,enid,ok,us,unknown,600,10 minutes,2 unknown objects&#44 moving @ incredible speed passed just feet above my car,6/27/2011,36.3955556,-97.8780556
7/15/1969 09:00,wasco,or,us,disk,120,about 2 min.,I saw the craft almost stationary about 75 yards out; and 75 yards high .I looked at for about one minute then ran back to our house to,11/1/1998,45.5919444,-120.6969444
7/15/1969 09:35,cape canaveral,fl,us,sphere,20,20 sec,check your home movies of apollo 11,12/2/2000,28.4055556,-80.605
7/15/1969 14:00,peoria,il,us,disk,60,one minute,flying disk over northern Peoria&#44 Illinois,11/20/2002,40.6936111,-89.5888889
7/15/1969 14:00,champaign,il,us,disk,300,5 minutes,UFO or Enormous &quot;Spider&quot;?  500 Lights On Object0: Yes,2/24/2007,40.1163889,-88.2433333
7/15/1969 20:30,fairfax,ca,us,disk,60,1 minute,Disk shaped craft appeared&#44 slowly zigzaged across town and took off.,5/24/1999,37.9872222,-122.5877778
7/15/1969 22:30,somerville,oh,us,light,300,5 mintues,my report is about a sighting on 7/15/1969 at 10:30pm where the sky lit up like day as bright as noon for about 5 minutes no sound was,9/21/2000,39.5630556,-84.6386111
7/15/1969 23:00,burlington,wa,us,other,30,30 seconds,I was returning home after seeing my girl friend&#44 trveling along a rural road between two corn fields a creature apprximatly 3 feet tal,2/14/2008,48.4758333,-122.3241667
7/27/1969 21:45,rocky mount,nc,us,sphere,900,15 minutes,A  FLYING OBJECT BURNED TOP OF TREES IN ROCKY MOUNT&#44 NC. 1969,5/15/2006,35.9380556,-77.7908333
7/30/1969 13:00,akron,oh,us,circle,10800,3 hours,Giant Silver Ball Hanging Over Akron In the Late 1960&#39s,7/4/2012,41.0813889,-81.5191667
7/30/1969 21:00,north augusta (canada),on,,triangle,10800,half hour approx,((HOAX))  JUST FOR THE RECORD THESE TIANGLE CRAFTS HAVE BEEN AROUND FOR SOME TIME,10/31/2008,44.761373,-75.738901
7/31/1969 20:00,summerville,sc,us,light,3600,an hour,Glowing light that filled the entire sky over summerville south carolina starting small then growing large enough to cover the sky.,6/12/2007,33.0183333,-80.1758333
8/1/1969 12:00,ohio (northwest),oh,,other,60,1 minute,floating craft 80 yds long by 30 yds wide&#44 6 spheres connected by cylindrical passages in the shape of a rectangle.,6/18/2004,40.417287,-82.907123
8/1/1969 17:30,dayton,oh,us,disk,60,1 minute,Large silver disk &quot;rolls&quot; alongf tree tops near Wright-Patterson AFB,8/5/2001,39.7588889,-84.1916667
8/1/1969 20:00,berlin (germany),,de,unknown,300,5 min,Professional airline pilots sighting UFO over East Germany,4/16/2005,52.516667,13.4
8/1/1969 21:00,new castle,pa,us,oval,3000,50 minutes plus,This was in 1969 and I was only 16. There were eight of my family and friend that witnessed this event. 500 Lights On Object0: Yes,7/4/2012,41.0036111,-80.3472222
8/1/1969 22:00,minnetonka,mn,us,light,60,less than one minute,Large bright white light hovering in minnetonka&#44 mn&#44 summer&#44 1969,12/23/2002,44.9133333,-93.5030556
8/5/1969 19:00,north haven,ct,us,disk,1200.0,20 mins,UFO explosion and sighting,4/22/2003,41.3908333,-72.86
8/7/1969 18:30,riverton (canada),mb,ca,circle,60.0,1 minute,1969/ Riverton&#44 Manitoba&#44 Sphere 1 minute time space alteration.,4/11/2014,51.0,-97.0
8/10/1969 00:00,barstow,ca,us,light,10,8- 10 seconds,Bright lights,4/17/2008,34.8986111,-117.0219444
8/13/1969 00:30,port chester,ny,us,other,2.0,1-2 seconds,2 solid boomerang-solid shapes in formation cross sky from horizon-overhead-behind bldg; 1.5 seconds; silent; color of cool fl. bulb,1/10/2009,41.0016667,-73.6661111
8/15/1969 01:00,baldwin city,ks,us,circle,8.0,8 seconds,object moved in fashion against all laws of physics.  90 degree instant turn. the entire object was dot of light.,10/31/2008,38.775,-95.1861111
8/15/1969 01:00,unknown,az,,circle,180.0,1-3 minutes,We saw a glowing yellow gold object 50 to 100 yards in diameter hovering above us as though wanting to communicate.,12/20/2000,34.911097,-111.396242
8/15/1969 02:00,johnstown,pa,us,triangle,600.0,10 minutes,WHAT I SAW WAS MUCH LIKE THE SIGHTING IN MILLSTADT&#44 ILL...ONLY ALL I COULD MAKE OUT WAS THE MOVING LIGHT FORMATION..SLOWLY  MOVING HORO,4/28/2001,40.3266667,-78.9222222
8/15/1969 12:00,port jefferson,ny,us,disk,3600.0,1 hour,Metallic Disc hovers high over commercial jet traffic.,4/9/2004,40.9463889,-73.0697222
8/15/1969 19:00,el cajon,ca,us,other,7.0,5-7 seconds,A creature crossed my path and ordered me not to hurt it&#44 as I was driving at the time.,1/10/2009,32.7947222,-116.9616667
8/15/1969 20:00,east barre,vt,us,cylinder,480.0,8 minutes,Fast moving but in jerky stops and starts,4/27/2007,44.1580556,-72.4508333
8/15/1969 20:00,rockford,il,us,other,180.0,3 minutes,Seen an object in the sky that appeared to be an old World War II plane&#44 buy wasn&#39t&#33,6/12/2008,42.2711111,-89.0938889
8/15/1969 21:30,toronto (canada),on,ca,circle,60.0,1 minute,silent 6-lighted disk size of fist at arm&#39s lenght&#44moving in small circles  ((NUFORC Note:  Advertising light??)),9/1/2004,43.666667,-79.416667
8/15/1969 21:30,biola,ca,us,cigar,180.0,3 min,It was long cigar shaped about 500 feet long with the under side giving off a bright white light.,2/14/2010,36.8022222,-120.0152778
8/15/1969 22:00,phouc vinh (viet nam),,,unknown,120.0,2 mins,I was on perimeter guard duty with 3 others who were off watch and asleep.I remember this vividly and can&#39t ever forget it.while lookin,4/27/2007,11.296371,106.806039
8/15/1969 22:00,lamont,ca,us,formation,5.0,4 to 5 seconds,9 to 13 objects in &quot;V&quot; formation travelling about 100 mi per second graze ionosphere.,11/26/2003,35.2597222,-118.9133333
8/15/1969 23:00,ensenada (15 miles south of) (mexico),,,formation,120.0,one hour,My brother&#44 a friend&#44 and I witnessed six craft over Baja&#44 Calif&#44 beach in October of 1969,10/31/2003,31.866743,-116.596371
8/17/1969 02:30,north hollywood,ca,us,sphere,600.0,10 minutes,Was up late watching TV and glanced out of nearby window to witness 6-7 bright orange lights to the south about half of a mile away.,11/2/1999,34.1722222,-118.3780556
8/19/1969 23:00,duncan (canada),bc,ca,cylinder,1200.0,15 to 20 minutes,A group of people sighted an &quot;object&quot; that hovered for some 15 minutes&#44 it pulsated red to mauve.,4/16/2005,48.783333,-123.7
8/27/1969 21:00,enfield,me,us,oval,900.0,10-15min,The object would stop and move and then blink off and be somewhere else in the sky. And started moving again but at a slow pace&#33,4/16/2005,45.2488889,-68.5688889
8/29/1969 19:00,vernon (canada),bc,ca,cigar,4.0,4 seconds,Large&#44 white cigar shaped object stops above house.,6/12/2008,46.183333,-62.883333
9/1/1969 02:30,walpole,ma,us,oval,300.0,5 minutes,The object just hovered for a few minutes without making sound.  There was no movement in the trees and the silence was deafening.,1/17/2004,42.1416667,-71.25
9/3/1969 20:00,rosedale (canada),on,ca,cylinder,300.0,about 5 min.,Elongated oval object with a soft orange/red glow&#44 moving silently.,4/16/2005,49.2,-121.74
9/9/1969 21:10,austin,tx,us,sphere,900.0,12-15 minutes,A ring of light appeared&#44 filled in with golden light&#44 increased in brightness while moving&#44 then gradually faded away.,12/14/2004,30.2669444,-97.7427778
9/10/1969 20:30,chatham (canada),on,ca,disk,600.0,8-10 mins,The saucer was black&#44dome top&#4425-30ft.in diam.8-10ft.high&#44flat bottom&#44what caught are eye was the white beam shining up into the sky .,10/30/2006,42.4,-82.183333
9/15/1969 22:00,merced,ca,us,unknown,900.0,10-15 minutes,One evening when I was returning from classes at the local college&#44 I was driving west on M Street that at that time led back into town,5/28/2005,37.3022222,-120.4819444
9/20/1969 23:00,fairbanks,ak,us,cigar,30.0,30 seconds,My sister and I were awakened by a flashing bright light. We looked out of the window and saw a hovering cigar shaped object. It stayed,4/26/2000,64.8377778,-147.7163889
10/1/1969 16:00,san francisco,ca,us,oval,600,5-10 min,It was in the afternoon just before sunset at 20 Steiner St SF CA I saw above me and there was one other person who was with me on the,8/30/1999,37.7750000,-122.4183333
10/13/1969 21:15,millington,tn,us,formation,259200,72 hours,Star-like&#44 8-point inverted V-shape&#44 changed to V-shape&#44 executed 1-second shift  from directly South to directly West.,1/29/2002,35.3413889,-89.8972222
10/13/1969 22:00,memphis,tn,us,formation,3600,1 hour,One object joining 9 others to complete a triangular formation.,9/24/2003,35.1494444,-90.0488889
10/15/1969 00:00,sharon,ct,us,oval,120,1-2 minutes,NO NOISE&#44 NO AIR MOVEMENT&#44 NO HEAT&#44LIGHTS UNDERSIDE&#44 HOVERED&#44,11/21/2010,41.8791667,-73.4772222
10/15/1969 06:00,pearl,ms,us,cigar,1200,15-20 minutes,Long overdue report of UFO witnessed at a close range--years ago,1/17/2004,32.2744444,-90.1319444
10/15/1969 18:30,wilmington,de,us,circle,60,1 minute,Moon sized object &quot;grew&quot; to fill entire sky&#44 then disappeared,1/5/2011,39.7458333,-75.5469444
10/15/1969 19:00,hurst,tx,us,disk,60,1 minute,the light that came as i called it,9/6/2002,32.8233333,-97.1702778
10/15/1969 19:00,miami,fl,us,changing,120,minutes,OCTOBER 1969 UFO SIGHTING BY ENTIRE FAMILY,5/2/2011,25.7738889,-80.1938889
10/15/1969 21:00,exeter (near),nh,us,cigar,1800,30 min,I was returning from the first Vietnam Moratorium (that is how I fix the date accurately) in Boston with some friends in an old VW bus.,5/4/2004,42.9813889,-70.9483333
10/15/1969 23:30,alpine,az,us,disk,300,5 mins,Fall&#44 clear&#44 full visual disc sighting unbelievable air manuevers &#44speed &#44 brightness.,4/27/2004,33.8480556,-109.1425
10/25/1969 06:00,erie,pa,us,circle,1200,20 minutes,bright circular object along Lake Erie,2/14/2006,42.1291667,-80.0852778
10/29/1969 21:00,fulton,ny,us,cigar,1200,20 minutes,Orange cigar shaped object drops material.,12/12/2011,43.3227778,-76.4175
10/30/1969 21:00,fulton,ny,us,cigar,600,10 minutes,orange cigar shaped object moved slowly from the ne.  it stopped and a piece of the same color fell from it and burst into flames. the,3/19/2009,43.3227778,-76.4175
10/30/1969 21:00,fulton,ny,us,cigar,240,4 minutes,orange cigar shaped object drops something that bursts into flames.,12/3/2004,43.3227778,-76.4175
10/31/1969 23:00,fulton,ny,us,circle,1200,20minutes,Large bright orange cigar shaped craft.,1/31/2004,43.3227778,-76.4175
11/1/1969 07:00,san juan capistrano,ca,us,unknown,10,10 seconds,My brother saw a little man.,11/8/2003,33.5016667,-117.6616667
11/1/1969 19:30,fairbanks,ak,us,formation,240,4 minutes,Sighting of 5 objects in a PENTAGON formation near Fairbanks&#44 Alaska around 1969,7/19/2010,64.8377778,-147.7163889
11/1/1969 22:00,camp pendleton,ca,,light,120,2 minutes,Object could only be seen through a Starlight Scope (infra-red device),10/31/2008,33.317842,-117.320512
11/1/1969 22:00,hogans camp resort,ca,,circle,300,five minutes,Lighted round craft hovered and then dropped down quickly and shot straight out and away. While hovering&#44 craft made a moaning sound.,10/31/2003,36.778261,-119.417932
11/5/1969 01:00,buford,ga,us,disk,20,20 sec,I was travelling home with two friends on Buford Hwy &#44Leaving A small town named Flowery Branch after a birth day party &#44Heading back h,11/3/2005,34.1205556,-84.0044444
11/13/1969 21:03,san jose,ca,us,light,7,7 seconds,Lime green lozenge -shaped light shot across the sky.,8/27/2009,37.3394444,-121.8938889
11/15/1969 06:00,vancouver (canada),bc,ca,sphere,25200,7 hours,translucent 12 inch balls of light that are sentient beings with a mission on our little sphere. 500 Lights On Object0: Yes,11/28/2007,49.25,-123.133333
