Date,city,state,country,shape,duration (seconds),duration (hours/min),comments,date posted,latitude,longitude 
11/22/1969 17:00,kenai,ak,us,light,300,5 minutes,My brother and I saw what we thought was a car approaching on the rise of a hill.  The lights were so bright we turned our eyes away fr,1/11/2002,60.5544444,-151.2583333
12/15/1969 16:00,glenmore,la,us,circle,20,15/20 sec,A very clear sighting on highway U.S. 165 in Louisiana north of Oakdale near the small town of Glenmora in 1969.,10/31/2003,30.2044444,-91.1972222
12/15/1969 21:00,viet nam (location not specified),,,disk,900,15 minutes,Saucer and Dome observed by Starlite Scope in Vietnam During the War.,7/16/2003,14.058324,108.277199
12/15/1969 23:00,richmond/berea,ky,,circle,30,30 seconds,Circular shaped&#44 glowing object&#44 hovering but moving slowly&#44 then  traveling at a speed of at least thousands of mies per hourl,10/30/2006,37.692171,-84.259497
12/21/1969 02:54,la serena (chile),,,light,2.51,02.51sec,lights with colors,10/11/2005,-29.906301,-71.250204
12/23/1969 15:00,middletown,ct,us,fireball,120,2 min.,i was 9 or 10 years old and i was slideing down my driveway as i got up from my sled and started to walk back up the driveway a firebal,10/8/2007,41.5622222,-72.6511111
12/23/1969 18:00,middletown,ct,us,circle,60,1 minute,i think the year was 1969 and im possitive it was in the winter because i was slideing down our driveway. i have been trying to find in,9/29/2004,41.5622222,-72.6511111
12/25/1969 21:38,rogersville,al,us,,120,90-120 sec,single laser-like red light traced numerous straight-line and angular &#39waypoints&#39 in  Christmas night sky,6/20/2011,34.8255556,-87.2947222
